date;username;tweet;keyword;Normalisasi
28/06/2022 13.36;mripossad;hal tercupu yaitu mencari masa dan berlindung dibalik base untuk memunculkan keributan  face with tears of joy  sorry to say lo pengecut k  ;pengecut;hal tercupu yaitu mencari masa dan berlindung dibalik base untuk memunculkan keributan face with tears of joy sorry to say kamu pengecut k
28/06/2022 13.33;darenboys23;  lapor ke pangdam jaya aja  mrka brani  ga pengecut kyk si itu ;pengecut;lapor ke pangdam jaya aja mrka brani tidak pengecut seperti si itu
28/06/2022 13.32;BillTemporo;fpi pengecut  gak berani jihad ke ambon ;pengecut;fpi pengecut tidak berani jihad ke ambon
28/06/2022 13.31;Metarubrisit7nd; biasa yg kek gitu pengecut gaberani di akunnya sendiri  jadilah di base bikin ricuh ;pengecut;biasa yang seperti gitu pengecut gaberani di akunnya sendiri jadilah di base bikin ricuh
28/06/2022 13.29;mripossad; pengecut kan gitu maennya dibase lachh;pengecut;pengecut kan gitu maennya dibase lachh
28/06/2022 13.29;_readandread;kalau emang jiu mau pergi  gpp  dia ngga sepenuhnya salah karena dari awal juga joe ga pernah berani ngomong yg sej  ;pengecut;kalau emang jiu mau pergi tidak apa-apa dia tidak sepenuhnya salah karena dari awal juga joe tidak pernah berani ngomong yang sej
28/06/2022 13.29;mutakhirr;seorang yang berani akan lebih baik daripada ribuan pengecut ;pengecut;seorang yang berani akan lebih baik daripada ribuan pengecut
28/06/2022 13.13;MasBay1898;  bacoot loe  share lok aja jangan jadi pecundang dan pengecut;pengecut;bacoot loe share lok aja jangan jadi pecundang dan pengecut
28/06/2022 13.04;muzzayyinzany;percuma aja lo cakep kalo ga punya harga diri  d4rkbot giliran didepan gaberani kalo diblkg ngmgin  ha ha pengecut     d4rkbot;pengecut;percuma aja kamu cakep kalo tidak punya harga diri d4rkbot giliran didepan gaberani kalo diblkg ngmgin ha ha pengecut d4rkbot
28/06/2022 12.57;Hariss_FZ;  haiyah pake akun pengecut lagak lu sok  jago;pengecut;haiyah pake akun pengecut lagak kamu sok jago
28/06/2022 12.55;ihwaumrrh4; pas kemaren nnton konser  bapaknya si neng bawain lagu pengecut  pdhl pengecutnya nonton konser bareng ogutt   ;pengecut;ketika kemaren nnton konser bapaknya si neng bawain lagu pengecut pdhl pengecutnya nonton konser bareng ogutt
28/06/2022 12.55;godham5; muskoplak laki2 pengecut se nusantara  thinking face   krn ketika dia b masalah dgn hukum  atas p buatannya s  ;pengecut;muskoplak laki2 pengecut se nusantara thinking face karena ketika dia b masalah dgn hukum atas p buatannya s
28/06/2022 12.51;efrinasarivs;aku tak berani menutup mata  sekadar memimpikan kita bersama pun aku tak berani apalagi ketika kubuka mataku  aku t  ;pengecut;aku tidak berani menutup mata sekadar memimpikan kita bersama pun aku tidak berani apalagi ketika kubuka mataku aku t
28/06/2022 12.34;ans_steph;  mental pengecut sih  menggantungkan kebahagiaan sama 1 orang  yg kalo lepas depresi  trus b  ;pengecut;mental pengecut sih menggantungkan kebahagiaan sama 1 orang yang kalo lepas depresi terus b
28/06/2022 12.26;Eritrosith; sebuah kenyataan yang berkata kalau hidup tidak akan pernah sempurna  karena hanya seorang pengecut yg mengharapkan hidup yg sempurna  ;pengecut;sebuah kenyataan yang berkata kalau hidup tidak akan pernah sempurna karena hanya seorang pengecut yang mengharapkan hidup yang sempurna
28/06/2022 12.22;Abahozan1; mang lu pinter  lu bukan cuma tolol dan goblog lu juga juga bencong pengecut  ngomong sok  ;pengecut;mang kamu pinter kamu bukan cuma tolol dan goblog kamu juga juga bencong pengecut ngomong sok
28/06/2022 12.18;oshblossom; main playing victim entar biar kaum meki pada dateng pengecut;pengecut;main playing victim entar biar kaum meki pada dateng pengecut
28/06/2022 12.16;ikanuraini_nov;sumpeh  gue kayanya makin benci sama lu  org paling tolol  goblok  pengecut yg pernah gue kenal  banyak bacot but n  ;pengecut;sumpeh aku kayanya makin benci sama kamu orang paling tolol goblok pengecut yang pernah aku kenal banyak bacot but dan
28/06/2022 12.16;syafiqsrzn;  orang macamni jenis melayu pengecut  depan2 goyang  belakang2 berani  percayalah bil  ;pengecut;orang macamni jenis melayu pengecut depan2 goyang belakang2 berani percayalah bil
28/06/2022 12.08;LeembuJ;  beaming face with smiling eyes  beaming face with smiling eyes  beaming face with smiling eyes  beaming face with smiling eyes pengecut dia;pengecut;beaming face with smiling eyes beaming face with smiling eyes beaming face with smiling eyes beaming face with smiling eyes pengecut dia
28/06/2022 12.05;seungk_17;menurutku aku yang paling pengecut diantara temen ku  mereka semua hebat keren lah pokoknya  tapi aku  stuck   ngga ada perkembangan apapun;pengecut;menurutku aku yang paling pengecut diantara temen aku mereka semua hebat keren lah pokoknya tapi aku stuck tidak ada perkembangan apapun
28/06/2022 12.05;starkun_tk;ishida kun   seseorang yg menindas yg lemah karena tidak mampu melawan yg kuat  lebih pantas disebut pengecut  bleach syquote;pengecut;ishida kun seseorang yang menindas yang lemah karena tidak mampu melawan yang kuat lebih pantas disebut pengecut bleach syquote
28/06/2022 12.02;Fido_id_;  bener bro  pemerintah usa pengecut  beraninya menggunakan tangan tangan orang untuk menghukum n  ;pengecut;bener bro pemerintah usa pengecut beraninya menggunakan tangan tangan orang untuk menghukum dan
28/06/2022 11.57;Utux22Sedana; pengecut lu ga punya nyali sama keq kaum lu yg sampah akwkaa  face vomiting  face vomiting  face vomiting  face vomiting ;pengecut;pengecut kamu tidak punya nyali sama keq kaum kamu yang sampah akwkaa face vomiting face vomiting face vomiting face vomiting
28/06/2022 11.56;xxrealminos; maaf joji tp aku dah ganti haluan kayaknya pengecut siap buat di play berkali2 mengiringi ovt tiap malam  ;pengecut;maaf joji tapi aku dah ganti haluan kayaknya pengecut siap buat di play berkali2 mengiringi ovt tiap malam
28/06/2022 11.54;KittiaKuroKuro;seseorang yang menindas yang lemah karena tidak bisa menang melawan yang kuat  lebih pantas disebut pengecut   ishida   bleach  bot;pengecut;seseorang yang menindas yang lemah karena tidak bisa menang melawan yang kuat lebih pantas disebut pengecut ishida bleach bot
28/06/2022 11.47;vhebi_639;menyerah sebelum berusaha itu namanya pengecut;pengecut;menyerah sebelum berusaha itu namanya pengecut
28/06/2022 11.46;thinkerbellee2;kok bisa ya ada cowo yg sopan santunnya 0 banget   kasar ke cewek  tukang kompor  banyak gaya  sombong ngga punya a  ;pengecut;kok bisa ya ada cowo yang sopan santunnya 0 banget kasar ke cewek tukang kompor banyak gaya sombong tidak punya a
28/06/2022 11.42;dedektriwidodo;lihat baik baik perbedaan nya  banyak sekali keburukan menyerupai kebaikan  pengecut menyerupai kehati hatian  jang  ;pengecut;lihat baik baik perbedaan nya banyak sekali keburukan menyerupai kebaikan pengecut menyerupai kehati hatian jang
28/06/2022 11.40;kawalkyai; getir   narasi kekalahan bagi yang merasa dirinya seharusnya berkuasa tapi kok ya kalah bisa terasa luar biasa get  ;pengecut;getir narasi kekalahan bagi yang merasa dirinya seharusnya berkuasa tapi kok ya kalah bisa terasa luar biasa get
28/06/2022 11.30;tonizno11; jangan lari dasar pengecut     kamado tanjiro;pengecut;jangan lari dasar pengecut kamado tanjiro
28/06/2022 11.29;mconeforall; beraninya main kepung  duel luh  kalo berani  dasar mbak mu pengecut ;pengecut;beraninya main kepung duel luh kalo berani dasar mbak mu pengecut
28/06/2022 11.27;PutraRa33763114;    ;pengecut;pengecut
28/06/2022 11.26;Pemuda91243306; bekingnya pengecut hahahaha;pengecut;bekingnya pengecut hahahaha
28/06/2022 11.22;Paramecwara;holywings ni  manajemennya udah pun ill mannered  pengecut pula ;pengecut;holywings ni manajemennya udah pun ill mannered pengecut pula
28/06/2022 11.21;ariyanto9993;bukannya hanya pengecut tapi juga munafik  ;pengecut;bukannya hanya pengecut tapi juga munafik
28/06/2022 11.15;mnusiabodoh_;  aku hanya seorang pengecut sedang jatuh hati  memberi perhatian tapi bukan kepastian  ;pengecut;aku hanya seorang pengecut sedang jatuh hati memberi perhatian tapi bukan kepastian
28/06/2022 11.14;CallMEdoel; mo keturunan atau bukan  yg namanya pengecut ya pengecut  pion dijadiin tumbal ;pengecut;mau keturunan atau bukan yang namanya pengecut ya pengecut pion dijadiin tumbal
28/06/2022 11.08;BryokAceh; satu kata pengecut;pengecut;satu kata pengecut
28/06/2022 11.05;bkngagamuhamad;aku hanya seorang pengecut yang sedang jatuh hati memberi perhatian tapi bukan kepastian ;pengecut;aku hanya seorang pengecut yang sedang jatuh hati memberi perhatian tapi bukan kepastian
28/06/2022 11.05;sadpiness_; setelah  april  kayaknya  pengecut  ini jadi lagu favorit deh;pengecut;setelah april kayaknya pengecut ini jadi lagu favorit deh
28/06/2022 10.56;myself_ddd; stress tuh org wkwk iri blg boss  pengecut bgt;pengecut;stress tuh orang wkwk iri blg boss pengecut banget
28/06/2022 10.56;Chokieee_; boro boro bilang suka  yang suka ajah gak ada  pengecut;pengecut;boro boro bilang suka yang suka ajah tidak ada pengecut
28/06/2022 10.54;FiersaBesari; setengah mati diriku  setengah hati dirimu     pengecut  versi live rilis di channel youtube saya malam ini pukul  ;pengecut;setengah mati diriku setengah hati dirimu pengecut versi live rilis di channel youtube saya malam ini pukul
28/06/2022 10.54;wansahbilal;  tdk menunjukkan identitas tp bersuara sama saja pengecut  manusia lemah;pengecut;tdk menunjukkan identitas tapi bersuara sama saja pengecut manusia lemah
28/06/2022 10.50;Ibra_brahmana;  liat nihh jg  cebong2 anarkis  tukang rusuh  bodoh  pengecut  ;pengecut;liat nihh juga cebong2 anarkis tukang rusuh bodoh pengecut
28/06/2022 10.49;twiceter_;lo tuh pengecut tau ga  gamau ambil pilihan tapi gamau salah juga kalo pake pilihan orang lain;pengecut;kamu tuh pengecut tau tidak gamau ambil pilihan tapi gamau salah juga kalo pake pilihan orang lain
28/06/2022 10.47;TxtFromMando;  org2 itu cuma minta 1 org dihukum  keroyokan pengecut  dan a  ;pengecut;org2 itu cuma minta 1 orang dihukum keroyokan pengecut dan a
28/06/2022 10.46;stfudoyie; pengecut loehh jey ;pengecut;pengecut loehh jey
28/06/2022 10.45;bagas_refaldi;ciri ciri pengecut  ;pengecut;ciri ciri pengecut
28/06/2022 10.45;anggadoxx;  2019 ganti presiden   inkonstitusional  sampe kaosnya aja dilarang   2024 jokowi lanjut   a  ;pengecut;2019 ganti presiden inkonstitusional sampe kaosnya aja dilarang 2024 jokowi lanjut a
28/06/2022 10.37;AlanAla63203107; bilang aja kalian takut anies jadi presiden  dasar pengecut;pengecut;bilang aja kalian takut anies jadi presiden dasar pengecut
28/06/2022 10.37;inyong_nae;pengecut ni sender yg ngirim i hv crush on u;pengecut;pengecut ni sender yang ngirim i hv crush on u
28/06/2022 10.36;annisasa435;ansor berlindung dibalik nama besar nu  pengecut ansor  ini negara hukum  bukan negra bapak kalian  ini jg bukan ne  ;pengecut;ansor berlindung dibalik nama besar nu pengecut ansor ini negara hukum bukan negra bapak kalian ini juga bukan ne
28/06/2022 10.24;Fans_of_Conan;seseorang yang menindas yang lemah karena tidak bisa menang melawan yang kuat  lebih pantas disebut pengecut   ishida   bleach  animequote;pengecut;seseorang yang menindas yang lemah karena tidak bisa menang melawan yang kuat lebih pantas disebut pengecut ishida bleach animequote
28/06/2022 10.18;ekoperasetyo; kkb pengecut   berani sama yg ga punya senjata;pengecut;kkb pengecut berani sama yang tidak punya senjata
28/06/2022 10.18;ekoperasetyo; kkb pengecut   berani sama yg ga punya senjata;pengecut;kkb pengecut berani sama yang tidak punya senjata
28/06/2022 10.16;RahmanKhairr;lepas tengok filem mat kilau ni  makin aku sedar kekayaan yang british kecapi sekarang pastinya mostly daripada apa  ;pengecut;lepas tengok filem mat kilau ni makin aku sedar kekayaan yang british kecapi sekarang pastinya mostly daripada apa
28/06/2022 10.09;jgndiliat_;wkekw siapa pengecut ini;pengecut;wkekw siapa pengecut ini
28/06/2022 10.06;yhanikim; orang bisa menjadi pengecut krna dia memiliki seseorang yang harus dia lindungi   sungkyunkwan scandal ;pengecut;orang bisa menjadi pengecut krna dia memiliki seseorang yang harus dia lindungi sungkyunkwan scandal
28/06/2022 10.06;SitiBadriahAh; lelaki buat wanita nangis  itu lelaki pengecut     lelaki dibuat nangis wanita  itu lelaki cemen    nggak adil ya   d;pengecut;lelaki buat wanita nangis itu lelaki pengecut lelaki dibuat nangis wanita itu lelaki cemen nggak adil ya d
28/06/2022 10.06;sukidanik;tweet nya gue hapus karena udah gak kondusif sampe ada yg bilang gue tolol wkwk panggil gue pengecut tapi sekali la  ;pengecut;tweet nya aku hapus karena udah tidak kondusif sampe ada yang bilang aku tolol wkwk panggil aku pengecut tapi sekali la
28/06/2022 10.03;SaintIsSun1; pelaku uda kabur say  biasaa  playing victim   rolling on the floor laughing  rolling on the floor laughing  rolling on the floor laughing  tipe pengecut  pas minger berdatangan malah kabur  ;pengecut;pelaku uda kabur say biasaa playing victim rolling on the floor laughing rolling on the floor laughing rolling on the floor laughing tipe pengecut ketika minger berdatangan malah kabur
28/06/2022 10.02;fuadnoer12;  pemimpin pengecut;pengecut;pemimpin pengecut
28/06/2022 10.00;CallMEdoel; namanya doang koh brillian   orangnya ga smart apalagi brilliant  wkwkwkwkwk pengecut taek ;pengecut;namanya doang koh brillian orangnya tidak smart apalagi brilliant wkwkwkwkwk pengecut taek
28/06/2022 10.00;RuhamaDiaz;cinta mengubah kekasaran menjadi kelembutan  mengubah pengecut menjadi pemberani  mengubah penderitaan menjadi keba  ;pengecut;cinta mengubah kekasaran menjadi kelembutan mengubah pengecut menjadi pemberani mengubah penderitaan menjadi keba
28/06/2022 10.00;DimasAnugrahe;cinta mengubah kekasaran menjadi kelembutan  mengubah pengecut menjadi pemberani  mengubah penderitaan menjadi keba  ;pengecut;cinta mengubah kekasaran menjadi kelembutan mengubah pengecut menjadi pemberani mengubah penderitaan menjadi keba
28/06/2022 10.00;suryadinanaa;cinta mengubah kekasaran menjadi kelembutan  mengubah pengecut menjadi pemberani  mengubah penderitaan menjadi keba  ;pengecut;cinta mengubah kekasaran menjadi kelembutan mengubah pengecut menjadi pemberani mengubah penderitaan menjadi keba
28/06/2022 09.59;ekoperasetyo; kkb pengecut   berani sama yang ga punya senjata;pengecut;kkb pengecut berani sama yang tidak punya senjata
28/06/2022 09.59;ekoperasetyo; kkb pengecut   berani sama yang ga punya senjata;pengecut;kkb pengecut berani sama yang tidak punya senjata
28/06/2022 15.46;AshAvril;kalau kau rasa aku rate matkilau tinggi sebab aku penyokong tegar sy kau silap  akulah manusia yang paling skeptik  ;munafik;kalau kamu rasa aku rate matkilau tinggi sebab aku penyokong tegar aku kamu silap akulah manusia yang paling skeptik
28/06/2022 15.43;CepCobra; ha2 takut ya ama anis hitam dan putih itu jelas  yg bahaya itu yg abu2   orang2 munafik wk2;munafik;ha2 takut ya ama anis hitam dan putih itu jelas yang bahaya itu yang abu2 orang2 munafik wk2
28/06/2022 15.42;masbarno; halaah munafik loe ris;munafik;halaah munafik loe ris
28/06/2022 15.40;ras_elase; bercakap akhirat  kubur  padang mahsyar  syurga  neraka bagai  ini yang kau follow  malulah wei   ;munafik;bercakap akhirat kubur padang mahsyar syurga neraka bagai ini yang kamu follow malulah wei
28/06/2022 15.40;AruziMunthe; slam ktp itu gus  atau islam yg munafik  kalo islam yg baik tk mgkin makan daging babi  hayoo ngomongin siapa kau ;munafik;slam ktp itu gus atau islam yang munafik kalo islam yang baik tk mgkin makan daging babi hayoo ngomongin siapa kamu
28/06/2022 15.39;taecentil; munafik mrk mah;munafik;munafik mereka mah
28/06/2022 15.39;ibnurus86968784;  ini memg negeri nya para manusia munafik dan otak koruptor;munafik;ini memg negeri nya para manusia munafik dan otak koruptor
28/06/2022 15.37;syaiful_4796;lebih baik di benci dari pada munafik hanya untuk di sukai orang ;munafik;lebih baik di benci dari pada munafik hanya untuk di sukai orang
28/06/2022 15.37;KingOfLipServis; elo sujud ma tuhan lo sedangkan 23 jam dan 55 menit lo sembah sujud dan memuji penipu macam   ;munafik;elo sujud ma tuhan kamu sedangkan 23 jam dan 55 menit kamu sembah sujud dan memuji penipu macam
28/06/2022 15.35;purnamaku4;aku ga munafik kalo aku doyan  tapi hey ada waktunya dan ada tempatnya  ga mungkin baru kenal trus aku langsung men  ;munafik;aku tidak munafik kalo aku doyan tapi hey ada waktunya dan ada tempatnya tidak mungkin baru kenal terus aku langsung men
28/06/2022 15.32;Sigmahalim;  bagi gerombolan anti islam  tindakan itu pas  ;munafik;bagi gerombolan anti islam tindakan itu ketika
28/06/2022 15.31;Syedzaf76488714; ansare sb aap ek  munafik janet ke adme han aur munafikat ke inteha per han  state bank imf ke contro  ;munafik;ansare sb aap ek munafik janet ke adme han aur munafikat ke inteha per han state bank imf ke contro
28/06/2022 15.28;IkhsanSumitro; itulah yg namanya munafik;munafik;itulah yang namanya munafik
28/06/2022 15.27;Rockgar12; giliran terpuruk langsung bohong lagi  dasar munafik ;munafik;giliran terpuruk langsung bohong lagi dasar munafik
28/06/2022 15.26;sultanoftasik; antara munafik pasal wayang  dia ni lah;munafik;antara munafik pasal wayang dia ni lah
28/06/2022 15.25;_4iiiii_naaaaaa; partaiknya paling keras bencinya setengah mati sama parpol yg maling  kasus sapi  kalau benci jangan k  ;munafik;partaiknya paling keras bencinya setengah mati sama parpol yang maling kasus sapi kalau benci jangan k
28/06/2022 15.22;takalokka;jangan sampai tampilan sudah baik tapi hati masih munafik karena allah melihat ikhlasnya hati  bukan sucinya penampilan fisik ;munafik;jangan sampai tampilan sudah baik tapi hati masih munafik karena allah melihat ikhlasnya hati bukan sucinya penampilan fisik
28/06/2022 15.21;planetwarok;  ane jg gak ada kepentingan apa2 atas tahta pak anis  ane gak minum miras  ane termasuk yg be  ;munafik;ane juga tidak ada kepentingan apa2 atas tahta pak anis ane tidak minum miras ane termasuk yang be
28/06/2022 15.20;uniemara;  eeehh  gue sengaja beli 5 hp buatan kapir loh  tujuannye u  ;munafik;eeehh aku sengaja beli 5 hp buatan kapir loh tujuannye u
28/06/2022 15.15;keyELFkey; bot  lo kalo mau ambil aja   gausah munafik deh jgn pura2 gamau gue juga tau lo itu mau tapi lo malu udah ambil ajah gausah munafik deh  ;munafik;bot kamu kalo mau ambil aja gausah munafik deh jangan pura2 gamau aku juga tau kamu itu mau tapi kamu malu udah ambil ajah gausah munafik deh
28/06/2022 15.15;snow_fog; eaa  terpelatuk sekali ya  pdhl dia suka jg ama tu karakter kan yaa  ah jgn lah munafik  ;munafik;eaa terpelatuk sekali ya pdhl dia suka juga ama tu karakter kan yaa ah jangan lah munafik
28/06/2022 15.12;kadrunmampos;munafik nya kaum kadrun kuatir pad merosot dikasih jalan keluar face with tears of joy  rolling on the floor laughing  lha buat apa ditutup jg ;munafik;munafik nya kaum kadrun kuatir pad merosot dikasih jalan keluar face with tears of joy rolling on the floor laughing lha buat apa ditutup juga
28/06/2022 15.10;FaizKha64744399; munafik ho tum;munafik;munafik ho tum
28/06/2022 15.10;ibnurus86968784;  emg udh takdir negeri ini di pimpin manusia 2 munafik yg sok suci layk nya nabi tpi bejat dan munafik ;munafik;emang udah takdir negeri ini di pimpin manusia 2 munafik yang sok suci layk nya nabi tapi bejat dan munafik
28/06/2022 15.10;kacaaauuu;munafik bangett klo kesayangan mas ini gak nangis pas d tinggal;munafik;munafik bangett kalau kesayangan mas ini tidak nangis ketika d tinggal
28/06/2022 15.09;irfiantys;w munafik klau g sedih dgn keadaan sekarang ini slightly smiling face ;munafik;aku munafik klau tidak sedih dgn keadaan sekarang ini slightly smiling face
28/06/2022 15.03;AnJelljimin; orang2 munafik beb biasa bikin muak;munafik;orang2 munafik beb biasa bikin muak
28/06/2022 15.02;Kodokkurus;ada 2 tipe manusia yang tidak layak hidup munafik dan pembohong ;munafik;ada 2 tipe manusia yang tidak layak hidup munafik dan pembohong
28/06/2022 15.01;chirping_magpie; cobalah jujur pada diri sendiri   adakah laki laki normal yang tidak suka melihat paha mulus  rasah  ;munafik;cobalah jujur pada diri sendiri adakah laki laki normal yang tidak suka melihat paha mulus rasah
28/06/2022 15.00;ustadzkhalid; play button  orang munafik    pushpin  dapatkan update setiap harinya video  poster ilmu  jadwal  dan hal lainnya dengan bergabung da  ;munafik;play button orang munafik pushpin dapatkan update setiap harinya video poster ilmu jadwal dan hal lainnya dengan bergabung da
28/06/2022 14.59;sabirah212; golongan munafik beracun level alam semesta;munafik;golongan munafik beracun level alam semesta
28/06/2022 14.59;fadmnf;aku dengar filem mat kilau  ada unsur unsur kl gangster   munafik  betul ke ;munafik;aku dengar filem mat kilau ada unsur unsur kalau gangster munafik betul ke
28/06/2022 14.56;Ndheso_;  xixixixixixi  rolling on the floor laughing  beaming face with smiling eyes  rolling on the floor laughing  beaming face with smiling eyes  beaming face with smiling eyes  beaming face with smiling eyes  org munafik mah gampang ditebak pdhal dlm hp lo banyak bokep   beaming face with smiling eyes  rolling on the floor laughing  beaming face with smiling eyes  rolling on the floor laughing ;munafik;xixixixixixi rolling on the floor laughing beaming face with smiling eyes rolling on the floor laughing beaming face with smiling eyes beaming face with smiling eyes beaming face with smiling eyes orang munafik mah gampang ditebak pdhal dlm hp kamu banyak bokep beaming face with smiling eyes rolling on the floor laughing beaming face with smiling eyes rolling on the floor laughing
28/06/2022 14.54;nocturnalicious;  contoh orang2 munafik yang ga mau terima rea  ;munafik;contoh orang2 munafik yang tidak mau terima rea
28/06/2022 14.53;e_mtd119;  lebih baik dianggap pekok tapi jujur daripada munafik dan merasa diri paling bersi  ;munafik;lebih baik dianggap pekok tapi jujur daripada munafik dan merasa diri paling bersi
28/06/2022 14.52;FBH0rgcwzaQpwh4; tenggelamkan anies dn nasdem aman nkri yang menyebabkan perpecahan itu politisi2 munafik;munafik;tenggelamkan anies dan nasdem aman nkri yang menyebabkan perpecahan itu politisi2 munafik
28/06/2022 14.48;Diwanda_deep;pegang dan simpan baik baik   penting buat menampar orang orang munafik saat gila jabatan diperebutkan ;munafik;pegang dan simpan baik baik penting buat menampar orang orang munafik saat gila jabatan diperebutkan
28/06/2022 14.47;sambat_tok_isie;karena ketika kita kerja  yang dipikirkan orang lain  ga munafik  pasti mikir ttg uang uang uang  bodo amat dg oran  ;munafik;karena ketika kita kerja yang dipikirkan orang lain tidak munafik pasti mikir ttg uang uang uang bodo amat dg oran
28/06/2022 14.46;pjmyoojin;perkara dance gitu doang allahuu gausa munafik lu klo tae buka baju kyk kemaren aja pada demen jing  mnding fokus  ;munafik;perkara dance gitu doang allahuu gausa munafik kamu kalau tae buka baju seperti kemaren aja pada demen jing mnding fokus
28/06/2022 14.45;rrhmndd; nama twitter lu ganti ga pantes pake nama khazanah  udah tau tempat haram trs melecehkan nabi muhammad eh  ;munafik;nama twitter kamu ganti tidak pantes pake nama khazanah udah tau tempat haram terus melecehkan nabi muhammad eh
28/06/2022 14.45;AnasIml1990;locked orang munafik  ;munafik;locked orang munafik
28/06/2022 14.44;mrslifeless;  kita dua takda masalah noh     ayat seorang munafik  setelah dia dah fitnah kita  dah lagakan kita dgn org lain   ;munafik;kita dua takda masalah noh ayat seorang munafik setelah dia dah fitnah kita dah lagakan kita dgn orang lain
28/06/2022 14.41;Ndheso_;  lo  munafik   simpanan bokep lo dlm hard disk banyak   jaman skrg sapa ga  ;munafik;kamu munafik simpanan bokep kamu dlm hard disk banyak jaman skrg sapa tidak
28/06/2022 14.40;PutraMinangGuci; sy muslim  fakksin adalah haram yg sangat haram karna mampu membinasakan diri  amp  akal  takkan ku turu  ;munafik;aku muslim fakksin adalah haram yang sangat haram karena mampu membinasakan diri sampai akal takkan aku turu
28/06/2022 14.38;GkIposanjatan;mat23 23celakalah kamu  hai ahli2 taurat dan orang2 farisi  hai kamu orang2 munafik  sebab persepuluhan dari selasih  adas manis dan sabda;munafik;mat23 23celakalah kamu hai ahli2 taurat dan orang2 farisi hai kamu orang2 munafik sebab persepuluhan dari selasih adas manis dan sabda
28/06/2022 14.38;Riudiu1;munafik bgt kalau ga nangis sama keadaan yang sekarang;munafik;munafik banget kalau tidak nangis sama keadaan yang sekarang
28/06/2022 14.36;artikaamp;lu yg munafik bangke;munafik;kamu yang munafik bangke
28/06/2022 14.31;NurulNaziefa_;kenapa lepat tak baca skrip tanda tanda orang munafik yang mat kilau sebut dalam cerita tu sekali  hm;munafik;kenapa lepat tidak baca skrip tanda tanda orang munafik yang mat kilau sebut dalam cerita tu sekali hm
28/06/2022 14.31;rainirahm;kalo ga suka sama orang   tapi mencoba baik baik aja pas liat orangnya  itu munafik ga sih   wkwk smiling face with tear ;munafik;kalo tidak suka sama orang tapi mencoba baik baik aja ketika liat orangnya itu munafik tidak sih wkwk smiling face with tear
28/06/2022 14.30;andhykaCOMs;  gaya lu kaya kontol onta   lu pake twiter emang bikinan sapa   bikinan jaz  ;munafik;gaya kamu kaya kontol onta kamu pake twiter emang bikinan sapa bikinan jaz
28/06/2022 14.30;Khoiron98925511;terlihat baik  namun kotor terlihat suci  namun hina terlihat berilmu  namun munafik  wahai jiwa yang selalu bersem  ;munafik;terlihat baik namun kotor terlihat suci namun hina terlihat berilmu namun munafik wahai jiwa yang selalu bersem
28/06/2022 14.29;astrosphile;gausah munafik  namanya manusia ya butuh validasi  daripada fokus ke  situ mending liat pesan utamanya sender klo h  ;munafik;gausah munafik namanya manusia ya butuh validasi daripada fokus ke situ mending liat pesan utamanya sender kalau h
28/06/2022 14.28;Hangtuah87; bapak munafik;munafik;bapak munafik
28/06/2022 14.27;Has_has81; betul  contoh orang munafik akut;munafik;betul contoh orang munafik akut
