date;username;tweet;keyword;Normalisasi
28/06/2022 15.30;GugunDepan;kamu tak akan sukses jika tak pernah gagal  tak akan bahagia jika tak sedih  dan tak temukan cinta sejati jika tak patah hati ;gagal;kamu tidak akan sukses jika tidak pernah gagal tidak akan bahagia jika tidak sedih dan tidak temukan cinta sejati jika tidak patah hati
28/06/2022 15.30;Ozaa_sajaa;gua mulai sendiri  gua sengsara sendiri gua gagal sendiri dan gua bakal sukses sendiri ;gagal;aku mulai sendiri aku sengsara sendiri aku gagal sendiri dan aku bakal sukses sendiri
28/06/2022 15.30;skayangku;  aku gk ngutuk rezeki dia  cuman kalau tau apa yg aku laluin setahun ini jg susa  ;gagal;aku tidak ngutuk rezeki dia cuman kalau tau apa yang aku laluin setahun ini juga susa
28/06/2022 15.48;iis_teguh;diduga tidak kuat menahan beban keluarga seorang ayah nekat menyewa kuli panggul pasar ;beban;diduga tidak kuat menahan beban keluarga seorang ayah nekat menyewa kuli panggul pasar
28/06/2022 15.48;twinshinobiy; kalo angkat beban jadi olahrga;beban;kalo angkat beban jadi olahrga
28/06/2022 15.48;DloveTaehyung;ini klo i gaada kyanya org rumah pada bahagia deh kyanya beban nya hilang;beban;ini kalau i gaada kyanya orang rumah pada bahagia deh kyanya beban nya hilang
28/06/2022 15.48;Muinjeong; yuk syg tapi aku beban;beban;yuk syg tapi aku beban
28/06/2022 15.47;IDESFAEGER;          tsk   adara berdecak kala ceritanya dianggap sebagai dongeng anak anak  setidaknya  keha  ;beban;tsk adara berdecak kala ceritanya dianggap sebagai dongeng anak anak setidaknya keha
28/06/2022 15.47;timeipu;blm 20 tpi beban idup byk beut ajgg;beban;blm 20 tapi beban idup byk beut ajgg
28/06/2022 15.47;semogakayaaa;dan akhirnya beban tanggungan 1 terselesaikan ;beban;dan akhirnya beban tanggungan 1 terselesaikan
28/06/2022 15.45;kladestiny; hadeh gasadar klo dirinya jg beban;beban;hadeh gasadar kalau dirinya juga beban
28/06/2022 15.44;jvunqkoq;kalau chara rare nya emang nyaman buat dibawain ga beban suka aja ;beban;kalau chara rare nya emang nyaman buat dibawain tidak beban suka aja
28/06/2022 15.44;rnsdee;kita remaja yg sedang dimabuk beban hidup;beban;kita remaja yang sedang dimabuk beban hidup
28/06/2022 15.44;NajahHajazy;tahukah anda   semut dapat mengangkat beban 50 kali tubuhnya;beban;tahukah anda semut dapat mengangkat beban 50 kali tubuhnya
28/06/2022 15.44;swiss_dewi1;kalau dipikir pikir ternyata beban ini banyak banget yaa  gak habis pikir slightly smiling face ;beban;kalau dipikir pikir ternyata beban ini banyak banget yaa tidak habis pikir slightly smiling face
28/06/2022 15.43;druigsjacket; go 6jt les private 9jt quipper 500k eduka 100k wangsit 200k gundar 12jt   untung balik nnti   ukt 6jt loudly crying face   ;beban;go 6jt les private 9jt quipper 500k eduka 100k wangsit 200k gundar 12jt untung balik  nanti ukt 6jt loudly crying face
28/06/2022 15.42;Celilurbae; magesup doang   beban pikiran dr mana tu anjeng;beban;magesup doang beban pikiran dari mana tu anjeng
28/06/2022 15.42;opnnnpan;tolong lah  loudly crying face  loudly crying face  gak usah nambah nambahin beban idup ;beban;tolong lah loudly crying face loudly crying face tidak usah nambah nambahin beban idup
28/06/2022 15.42;CarelineSesb;jangan sesekali letakkan beban berlebihan pada soket  demi keselamatan anda  lebih baik anda hanya menggunakan satu  ;beban;jangan sesekali letakkan beban berlebihan pada soket demi keselamatan anda lebih baik anda hanya menggunakan satu
28/06/2022 15.41;bollychiious; mang yg tdi beban ;beban;mang yang tdi beban
28/06/2022 15.41;itsmeilifluous;capek hidup cuma jadi sapi perah tapi dikatain beban ;beban;capek hidup cuma jadi sapi perah tapi dikatain beban
28/06/2022 15.41;mayumipedasenak;pernah diposisi dicari walaupun cuma itu itu aja orangnya  beban bgt sumpah  duit abis dan ngerasa ngerepotin bgt w  ;beban;pernah diposisi dicari walaupun cuma itu itu aja orangnya beban banget sumpah duit abis dan ngerasa ngerepotin banget aku
28/06/2022 15.41;vllataenie; duh dikatain beban am anak tiktok  yailah bro  disappointed face ;beban;duh dikatain beban am anak tiktok yailah bro disappointed face
28/06/2022 15.40;beenAhuman; nah ini nih  kek beban bgt;beban;nah ini ini seperti beban banget
28/06/2022 15.39;cluescents;ketawa bgt  hobby gue beneran gemar nambahin beban ke sapa loudly crying face  loudly crying face  folded hands ;beban;ketawa banget hobby aku beneran gemar nambahin beban ke sapa loudly crying face loudly crying face folded hands
28/06/2022 15.39;ttmlfh; tapi beban mentalnya lumayan   ;beban;tapi beban mentalnya lumayan
28/06/2022 15.39;alcessia790; yg cewe beban;beban;yang cewe beban
28/06/2022 15.39;caaaaaaaaaaaa__;  ngam oh hilang beban 10k  upah tak duak 5k jak sama dirik nak ohh  face holding back tears ;beban;ngam oh hilang beban 10k upah tidak duak 5k jak sama dirik mau ohh face holding back tears
28/06/2022 15.38;missw1n;beban;beban;beban
28/06/2022 15.38;idntimes;bayi yang belum imunisasi jadi beban ganda pandemik ;beban;bayi yang belum imunisasi jadi beban ganda pandemik
28/06/2022 15.38;arnbear; awowkwk yang beban itu army tiktod  ;beban;awowkwk yang beban itu army tiktod
28/06/2022 15.38;bunbears_; fc cuma bonus  yang jadi point  nya jalan ceritanya itu sendirii  bawa santaii aja ygy grinning face with sweat  baca au buat hib  ;beban;fc cuma bonus yang jadi point nya jalan ceritanya itu sendirii bawa santaii aja ygy grinning face with sweat baca au buat hib
28/06/2022 15.37;matchabknrumput; go 4jt wangsit   buku dll   500k gojek bolak balik les yallah 50k les    lesnya 2x minggu sadhar 200k x  ;beban;go 4jt wangsit buku dan lain-lain 500k gojek bolak balik les yallah 50k les lesnya 2x minggu sadhar 200k x
28/06/2022 15.37;emeienaroui;alhamdulillah ya allah  ga jadi beban ortu folded hands  loudly crying face   allah tau baget keadaan hambanya;beban;alhamdulillah ya allah tidak jadi beban ortu folded hands loudly crying face allah tau baget keadaan hambanya
28/06/2022 15.37;elyapujautamii; sumpah beban bgt bacanya  ovt lagi kan gw face exhaling  face exhaling ;beban;sumpah beban banget bacanya ovt lagi kan aku face exhaling face exhaling
28/06/2022 15.37;Gheea12; plis deh  jangan nambah beban pikiran  sesungguhnya umat manusia jika mempersulit manusia laiinnya maka ia akan di azab;beban;plis deh jangan nambah beban pikiran sesungguhnya umat manusia jika mempersulit manusia laiinnya maka ia akan di azab
28/06/2022 15.36;jayblajar22;  sama  gue takut beban mental;beban;sama aku takut beban mental
28/06/2022 15.35;fsskroeppreal;menepilah  kamu nampak lelah  kemarilah  lepaskan beban bebanmu itu di pelukanku   ;beban;menepilah kamu nampak lelah kemarilah lepaskan beban bebanmu itu di pelukanku
28/06/2022 15.35;SutanNasrul; aturan penerbangan  bbm yg dipakai pada awal perjalanan harus dilebihkan dari konsumsi   ketika akan  ;beban;aturan penerbangan bbm yang dipakai pada awal perjalanan harus dilebihkan dari konsumsi ketika akan
28/06/2022 15.34;jivamagnolya; 1 460 jt  semoga tembus dimandiri biar ga terlalu jadi beban pensive face ;beban;1 460 jt semoga tembus dimandiri biar tidak terlalu jadi beban pensive face
28/06/2022 15.34;Mataminimaliz;ortu masih lengkap masih pada sehat juga tapi berasa banget mikul beban kebutuhan buat rumah udah gtu kedua ortu ra  ;beban;ortu masih lengkap masih pada sehat juga tapi berasa banget mikul beban kebutuhan buat rumah udah gitu kedua ortu ra
28/06/2022 15.34;leovaldhez;mpkt sampe akhir semester msh beban aje anjg;beban;mpkt sampe akhir semester msh beban aje anjg
28/06/2022 15.34;eolmay;haii i m back  akhirnyaa bisa twitteran 24 7 tanpa beban loudly crying face  yaa walaupun cmn wktu liburan semesteran ini doang smiling face with tear ;beban;haii i m back akhirnyaa bisa twitteran 24 7 tanpa beban loudly crying face yaa walaupun cmn wktu liburan semesteran ini doang smiling face with tear
28/06/2022 15.33;JakmaniaSkh;dear   udah  main lepas aja  jangan ada beban untuk menang  gua ga bakal kecewa ko kalo kalah  ekspekta  ;beban;dear udah main lepas aja jangan ada beban untuk menang aku tidak bakal kecewa ko kalo kalah ekspekta
28/06/2022 15.32;trejopriv; go 4jt an  buku the king 125k pendaftaran sbm 250k tiket kereta pp 140k hotel bareng temen 200k daftar  ;beban;go 4jt an buku the king 125k pendaftaran sbm 250k tiket kereta pp 140k hotel bareng temen 200k daftar
28/06/2022 15.32;oishiisoda; aku kira hidup aja udah beban   ternyata fangirling jd beban juga kl gini  ;beban;aku kira hidup aja udah beban ternyata fangirling jadi beban juga kalau gini
28/06/2022 15.32;shiroishiro00; makin terasa jadi beban keluarganya;beban;makin terasa jadi beban keluarganya
28/06/2022 15.31;mitsuoyaa;izumi walaupun tipikal pacar beban tp dia punya effort ;beban;izumi walaupun tipikal pacar beban tapi dia punya effort
28/06/2022 15.31;BNNyaaa;seberat apapun beban masalah yang kamu hadapi saat ini  percayalah bahwa semua itu tidak pernah melebihi batas kemampuan kamu  eaw;beban;seberat apapun beban masalah yang kamu hadapi saat ini percayalah bahwa semua itu tidak pernah melebihi batas kemampuan kamu eaw
28/06/2022 15.31;apocalypticola; tujuan utama gue sebenernya mau adek gue bisa pergi sejauh mungkin ngejar ambisinya tanpa mikir 2 k  ;beban;tujuan utama aku sebenernya mau adik aku bisa pergi sejauh mungkin ngejar ambisinya tanpa mikir 2 k
28/06/2022 15.31;luvrasa; beban hidup aja udah ribet  masa username sosmed ribet juga nanti pusing loudly crying face  loudly crying face  loudly crying face ;beban;beban hidup aja udah ribet masa username sosmed ribet juga nanti pusing loudly crying face loudly crying face loudly crying face
28/06/2022 15.31;karirfess;kr  hai  aku lulusan smk 2020  masih cari2 kerja  terus ada tawaran kuliah gratis  pleading face  aku bimbang soalnya hatiku pe  ;beban;kr hai aku lulusan smk 2020 masih cari2 kerja terus ada tawaran kuliah gratis pleading face aku bimbang soalnya hatiku pe
28/06/2022 15.31;merona_satire;  nih bun  apapun itu kita menanggung beban orang yg mengikuti kita  karena  apapun yang  ;beban;ini bun apapun itu kita menanggung beban orang yang mengikuti kita karena apapun yang
28/06/2022 15.31;HeikalYudha22;  alhamdillah  jangan latihan motor sel  tetaplah jadi beban buat temen2 lu  folded hands ;beban;alhamdillah jangan latihan motor sel tetaplah jadi beban buat temen2 kamu folded hands
28/06/2022 15.30;scraxsim;ga ada dosanya gangguin orang ini beban ;beban;tidak ada dosanya gangguin orang ini beban
28/06/2022 15.30;aesthethi;alhamdulillah finish for ecj  sparkles  beban berkurang satu persatu thumbs up light skin tone ;beban;alhamdulillah finish for ecj sparkles beban berkurang satu persatu thumbs up light skin tone
28/06/2022 15.30;strawberriesdk;habis itu beban hidupku abis deh  sisa 2 pc yang kebablasan nyoret aja  d;beban;habis itu beban hidupku abis deh sisa 2 pc yang kebablasan nyoret aja d
28/06/2022 15.30;__selviseptiani;hanya tidak ingin menjadi beban siapapun ;beban;hanya tidak ingin menjadi beban siapapun
28/06/2022 15.30;bucingranger;mama  dek  km tu kerjaannya haha hihi haha hihi gaada beban  enteng bgt hidupmu ya nak  aku setiap malam  ovt  mena  ;beban;mama dek kamu tu kerjaannya haha hihi haha hihi gaada beban enteng banget hidupmu ya mau aku setiap malam ovt mena
28/06/2022 15.29;Nadasenjaa_;aku sedang belajar membiasakan diri  sedang belajar bagaimana mengikhlaskan sebuah kepergian  belajar bagaimana mel  ;beban;aku sedang belajar membiasakan diri sedang belajar bagaimana mengikhlaskan sebuah kepergian belajar bagaimana mel
28/06/2022 15.29;deareveryonenu; aamiin kak  semangat yaa  kalo beban mu segitu  yakin deh reward yg allah kasih jauuh lebih lebih pok  ;beban;aamiin kak semangat yaa kalo beban mu segitu yakin deh reward yang allah kasih jauuh lebih lebih pok
28/06/2022 15.29;rrrrrafla;  makanya mending main sama orang yg emang nganggep kamu teammate  bukan beban atau sampah apapun role mu ;beban;makanya mending main sama orang yang emang nganggep kamu teammate bukan beban atau sampah apapun role mu
28/06/2022 15.29;Yayaya4858859;  ya beda nder  bawa beban hidupnya nambah soalnya  face with tears of joy ;beban;ya beda sender bawa beban hidupnya nambah soalnya face with tears of joy
28/06/2022 15.28;mignoen; si paling bukan beban;beban;si paling bukan beban
28/06/2022 15.28;markleesnct;taii nambah beban ultah deui ini anjiirrlah  clown face  clown face  clown face ;beban;taii nambah beban ultah deui ini anjiirrlah clown face clown face clown face
28/06/2022 15.28;foxiew00;jadi  adik gw kayanya kalo daftar st4n kayanya pastitlolos  w tahu kemampuan di tes sejenis cpns bagus banget  masa  ;beban;jadi adik aku kayanya kalo daftar st4n kayanya pastitlolos aku tahu kemampuan di tes sejenis cpns bagus banget masa
28/06/2022 15.28;TrisaktiMebel;biasakan segera mencuci piring kotor di dapur  semakin cepat anda melakukannya  maka beban anda menjaga kebersihan dapur akan semakin ringan;beban;biasakan segera mencuci piring kotor di dapur semakin cepat anda melakukannya maka beban anda menjaga kebersihan dapur akan semakin ringan
28/06/2022 15.27;telurasin99; kalian akan masuk janah dengan damai    kalimat hadits ini berperan sebagai slogan kaum mukminin yang mampu meletu  ;beban;kalian akan masuk janah dengan damai kalimat hadits ini berperan sebagai slogan kaum mukminin yang mampu meletu
28/06/2022 15.27;akunkiia; wajib banget ini mah  kalau ga jadi beban keluarga lagi    ;beban;wajib banget ini mah kalau tidak jadi beban keluarga lagi
28/06/2022 15.27;Cmeansevrything;ngga soalnya gada duit wkwkwk alhamdulilah jd ga nambah beban di lemari buku  pensive face  ;beban;tidak soalnya gada duit wkwkwk alhamdulilah jadi tidak nambah beban di lemari buku pensive face
28/06/2022 15.26;Rizkamylndp_;merekapun pasti memiliki masalah masing masing saya hanya tidak ingin menjadi beban pikiran mereka juga dan lagi ti  ;beban;merekapun pasti memiliki masalah masing masing saya hanya tidak ingin menjadi beban pikiran mereka juga dan lagi ti
28/06/2022 15.26;luvhcssi; kalo kaya gini mending ga usah solo  beban;beban;kalo kaya gini mending tidak usah solo beban
28/06/2022 15.26;yourmarkl;yh 2 beban pikiran w hari ini sudab hilang n sudah jelas ;beban;yah 2 beban pikiran aku hari ini sudab hilang dan sudah jelas
28/06/2022 15.25;kyrhmaa;sgt amt mjd beban;beban;sgt amt mjd beban
28/06/2022 15.25;nrqmrr; iya enak bangun bangun udah gada beban wkwk;beban;iya enak bangun bangun udah gada beban wkwk
28/06/2022 15.25;dearzenin; gue sih udah gak stress gak jadi beban juga  wong gue gak ada beban  cuma ini gak tepat dikatakan stress   ;beban;aku sih udah tidak stress tidak jadi beban juga wong aku tidak ada beban cuma ini tidak tepat dikatakan stress
28/06/2022 15.25;reysarosdayanti;antara senang sama beban;beban;antara senang sama beban
28/06/2022 15.25;Memosastra5;ekspektasi masyarakat terhadap tampilnya anies rasyid baswedan menjadikan biaya kampanye capresnya akan menjadi san  ;beban;ekspektasi masyarakat terhadap tampilnya anies rasyid baswedan menjadikan biaya kampanye capresnya akan menjadi san
28/06/2022 15.25;KataPematah;  ya syukur kalau gak pernah  suci berarti  kalau aku sama teman ya sering  namanya juga candaan  ;beban;ya syukur kalau tidak pernah suci berarti kalau aku sama teman ya sering namanya juga candaan
28/06/2022 15.24;hoonsyoung; ini yg jadi beban pikiran gue daritadii;beban;ini yang jadi beban pikiran aku daritadii
28/06/2022 15.24;kiyeounlino; bener bangett  mereka yg nemenin dari jaman masih jadi bocil alay sampe skrg banyak beban hidup  masa  ;beban;bener bangett mereka yang nemenin dari jaman masih jadi bocil alay sampe skrg banyak beban hidup masa
28/06/2022 15.23;_Andrizbarant__; jan aku banget kuwi  diutangi adalah beban  beaming face with smiling eyes  beaming face with smiling eyes  beaming face with smiling eyes ;beban;jan aku banget kuwi diutangi adalah beban beaming face with smiling eyes beaming face with smiling eyes beaming face with smiling eyes
28/06/2022 15.23;najmaanjay;gue td cuma bilang kalo temen gue keterima di smk 1 jkt  trs mak gue malah ngomong  kalo ngomong begitu tu pgn mara  ;beban;aku td cuma bilang kalo temen aku keterima di smk 1 jkt terus mak aku malah ngomong kalo ngomong begitu tu pgn mara
28/06/2022 15.23;4ddest; memang beban keluarga;beban;memang beban keluarga
28/06/2022 15.23;windflowersss; kalo aku lebih ke beban timbangan sih sbenarny;beban;kalo aku lebih ke beban timbangan sih sbenarny
28/06/2022 15.22;juhaiman15; seharusnya ikn ngga dibuat  beban rakyat saja ;beban;seharusnya ikn tidak dibuat beban rakyat saja
28/06/2022 15.22;melicoww; tersenyum beban;beban;tersenyum beban
28/06/2022 15.22;MalaysiaGazette;kurangkan beban kos rakyat malaysiagazette ;beban;kurangkan beban kos rakyat malaysiagazette
28/06/2022 15.21;erlnmyrsh;lagian kenapa sih harus bikin gua mikir yg enggak enggak  emng ga kepikiran apa klo omongan lu bakal jdi beban pikiran orang lain bangsat;beban;lagian kenapa sih harus bikin aku mikir yang enggak enggak emng tidak kepikiran apa kalau omongan kamu bakal jadi beban pikiran orang lain bangsat
28/06/2022 15.21;oktiasr;menatap langit lalu berbagi cerita  berharap beban ini terbagi sedikit  ingin berteriak kepada semesta bahwa ini cu  ;beban;menatap langit lalu berbagi cerita berharap beban ini terbagi sedikit ingin berteriak kepada semesta bahwa ini cu
28/06/2022 15.21;prilaprilia8;si beban keluarga  slightly smiling face  ;beban;si beban keluarga slightly smiling face
28/06/2022 15.21;kangmekdi;  gapernah si bang ngata in orang beban mah  gw ga jago juga soalnya  abangnya sering ya  pasti pro player;beban;gapernah si bang ngata in orang beban mah aku tidak jago juga soalnya abangnya sering ya pasti pro player
28/06/2022 15.20;hahahasabil; aduh sbnrnya takut klo diitung hehe  bimbel offline 5 5jt  bimbel online  qiupper  600k  zenius 290k  m  ;beban;aduh sbnrnya takut kalau diitung hehe bimbel offline 5 5jt bimbel online qiupper 600k zenius 290k m
28/06/2022 15.20;lulabywithme;ya gmn anaknya mau ngerti  ngmg aja enggak   meski emg sbnrnya kk ku pun kek tai juga dibilangin malah ga peduli da  ;beban;ya bagaimana anaknya mau ngerti ngmg aja enggak meski emang sbnrnya kk aku pun seperti tai juga dibilangin malah tidak peduli da
28/06/2022 15.19;dhydudidam; mungkin sekalian doanya buat semua beban idup lu menk;beban;mungkin sekalian doanya buat semua beban idup kamu menk
28/06/2022 15.19;fishikuy;g berani ngejumlah krn gagal semuaa wkwkw beban keluarga ;beban;tidak berani ngejumlah karena gagal semuaa wkwkw beban keluarga
28/06/2022 15.19;leeyayasminee; allahu yeke  aku beban ke ni   pleading face ;beban;allahu yeke aku beban ke ni pleading face
28/06/2022 15.19;inistephdisini;akhirnya pergi  hangout  beneran yaa skrg dan temennya ga itu  mulu slightly smiling face  folded hands  ofc tdk beban smiling face ;beban;akhirnya pergi hangout beneran yaa skrg dan temennya tidak itu mulu slightly smiling face folded hands ofc tdk beban smiling face
28/06/2022 15.18;Ardyan_jaya; beban kehidupan;beban;beban kehidupan
28/06/2022 15.17;Astungkara13; yang penting happy  setidaknya beban hidup keluar;beban;yang penting happy setidaknya beban hidup keluar
28/06/2022 15.17;manutd_world;neil ryan   saya selalu percaya jika scott dapat menjadi pemain luar biasa untuk mufc  ia menanggung beban yang sa  ;beban;neil ryan saya selalu percaya jika scott dapat menjadi pemain luar biasa untuk mufc ia menanggung beban yang sa
28/06/2022 15.16;NJMCHOU; yg penting mainnya oke  ga troll  ga ganggu kemenangan tim  itu ga beban yh sat  ga semua org bisa all ro  ;beban;yang penting mainnya oke tidak troll tidak ganggu kemenangan tim itu tidak beban yah sat tidak semua orang bisa all ro
28/06/2022 15.16;dincny; emang punya anak itu beban  aku belum jadi ortu  belum nikah  tp aku sadar diri ajaa face with tears of joy ;beban;emang punya anak itu beban aku belum jadi ortu belum nikah tapi aku sadar diri ajaa face with tears of joy
28/06/2022 15.48;ms903cte;  pengecut tuh kolak  rolling on the floor laughing ;pengecut;pengecut tuh kolak rolling on the floor laughing
28/06/2022 15.40;hujanawal;  pengecut opo su ;pengecut;pengecut opo su
28/06/2022 15.39;2komaini_ahmad4; follow akun pengecut kayak gini  min    ampun dah ;pengecut;follow akun pengecut kayak gini min ampun dah
28/06/2022 15.39;emie_ys;terpaling sooyaas  face vomiting  keja dia nak nasty kan orang je pelik  dok cari gaduh dengan snows dan hollies yang terang t  ;pengecut;terpaling sooyaas face vomiting keja dia mau nasty kan orang aja pelik dok cari gaduh dengan snows dan hollies yang terang t
28/06/2022 15.37;illiayetrench;tapi pengecut tidak bisa menjadi begitu kuat dan menanggung kesulitan sendiri hingga saat ini  nami   one piece;pengecut;tapi pengecut tidak bisa menjadi begitu kuat dan menanggung kesulitan sendiri hingga saat ini nami one piece
28/06/2022 15.36;1febri;sering seringlah cemas biar paranoid sekalian sampe gila  ternyata rrc pengecut ;pengecut;sering seringlah cemas biar paranoid sekalian sampe gila ternyata rrc pengecut
28/06/2022 15.36;MRLofficials; mat hasan pengecut dokek orang kan main cakap bosar garang tegas  baru kena gertak dgn setiausaha zahid d  ;pengecut;mat hasan pengecut dokek orang kan main cakap bosar garang tegas baru kena gertak dgn setiausaha zahid d
28/06/2022 15.17;ayudalilahh;tak puas hati dgn aku bgitau lah sial  ni kau pengecut guna orang atas tarik oncall aku hahahah;pengecut;tidak puas hati dgn aku bgitau lah sial ni kamu pengecut guna orang atas tarik oncall aku hahahah
28/06/2022 15.15;NdaRrue; orang jepang keliru nyikapin nerjemahin kalimat  itu maksudnya supaya berjuang sampe penghabisan dan b  ;pengecut;orang jepang keliru nyikapin nerjemahin kalimat itu maksudnya supaya berjuang sampe penghabisan dan b
28/06/2022 15.05;freyyciaa_;org paling pengecut dan paling sampah yg pernah gua liat;pengecut;orang paling pengecut dan paling sampah yang pernah aku liat
28/06/2022 14.58;Heru76524144;  pengecut macam zonk nggak punya cermin sih di runahnya ;pengecut;pengecut macam zonk nggak punya cermin sih di runahnya
28/06/2022 14.58;rosedcoloredboy; aku hanya seorang pengecut sedang jatuh hati  memberi perhatian tapi bukan kepastian   sopan kali lirik ini folded hands ;pengecut;aku hanya seorang pengecut sedang jatuh hati memberi perhatian tapi bukan kepastian sopan kali lirik ini folded hands
28/06/2022 14.42;aldienfit; oalaahh pengecut;pengecut;oalaahh pengecut
28/06/2022 14.37;historyGUE;menyatakan secara langsung lebih baik daripada menjadi pengecut yang hanya berbicara dan menjelek jelekan dibelakang    ;pengecut;menyatakan secara langsung lebih baik daripada menjadi pengecut yang hanya berbicara dan menjelek jelekan dibelakang
28/06/2022 14.36;Onepiece_IDN; jangan menghina shanks dan yang lain   mereka bukan pengecut     luffylaw;pengecut;jangan menghina shanks dan yang lain mereka bukan pengecut luffylaw
28/06/2022 14.32;whereareyouluph; goodluck mbak semoga hasilnya sesuai keinginan  salut banget sama keberaniaannya  ga kayak aku yang pen  ;pengecut;goodluck mbak semoga hasilnya sesuai keinginan salut banget sama keberaniaannya tidak kayak aku yang pengen
28/06/2022 14.32;readtilldied; merasa beruntung udah denger  pengecut  versi live hehehe;pengecut;merasa beruntung udah denger pengecut versi live hehehe
28/06/2022 14.27;KepoSeru;biar kecut  asal bukan pengecut   petualangan sherina;pengecut;biar kecut asal bukan pengecut petualangan sherina
28/06/2022 14.27;MariamDalila;pengecut mati banyak kali sebelum kematiannya  yang berani mati hanya sekali  mutiarakata;pengecut;pengecut mati banyak kali sebelum kematiannya yang berani mati hanya sekali mutiarakata
28/06/2022 14.22;thewweskywalker; keren kak  kl gua si emg pengecut aja bukan gengsi gmw confess dluan  loudly crying face ;pengecut;keren kak kalau aku si emang pengecut aja bukan gengsi gmw confess dluan loudly crying face
28/06/2022 14.20;binaratmaja; setengah mati diriku  setengah hati dirimu     pengecut  versi live rilis di channel youtube saya malam ini pukul  ;pengecut;setengah mati diriku setengah hati dirimu pengecut versi live rilis di channel youtube saya malam ini pukul
28/06/2022 14.14;heyadhy;  aku hanya seorang pengecut sedang jatuh hati  memberi perhatian tapi bukan kepastian     fiersa besa  ;pengecut;aku hanya seorang pengecut sedang jatuh hati memberi perhatian tapi bukan kepastian fiersa besa
28/06/2022 14.07;lexalexall; franco selena hanzo hanzo franco hero pengecut ultinya nyebelin expressionless face ;pengecut;franco selena hanzo hanzo franco hero pengecut ultinya nyebelin expressionless face
28/06/2022 14.07;wakidijon; hipokrit dan sikap pengecut  nda ada asap klo nda ada api;pengecut;hipokrit dan sikap pengecut tidak ada asap kalau tidak ada api
28/06/2022 14.02;aclassicia;orang orang yg komen seenak liurnya pake fake account  bukannya itu namanya pengecut ya ;pengecut;orang orang yang komen seenak liurnya pake fake account bukannya itu namanya pengecut ya
28/06/2022 13.51;ica_mhrniiii;harusnya kamu bilang aja kalo kamu udaa ada orang lain kamu uda ga sayang sama aku  perasaan ini uda basi  hubungan  ;pengecut;harusnya kamu bilang aja kalo kamu udaa ada orang lain kamu uda tidak sayang sama aku perasaan ini uda basi hubungan
28/06/2022 13.48;zhixinJs; berani buat  tak berani mengaku  pengecut pasangan najib aka pencuri ni ;pengecut;berani buat tidak berani mengaku pengecut pasangan najib aka pencuri ni
28/06/2022 13.42;mewanimine;bagi email berkajang2 just to blame me  pengecut yee kalau berani sgt nk blame aku  include lah orang lain  smiling face with horns  inclu  ;pengecut;bagi email berkajang2 just to blame me pengecut yee kalau berani sgt mau blame aku include lah orang lain smiling face with horns inclu
28/06/2022 13.41;txtdaritanjiro; jangan lari dasar pengecut     kamado tanjiro;pengecut;jangan lari dasar pengecut kamado tanjiro
28/06/2022 13.40;richoiko; natalia  hero pengecut gak mau berani menampakkan diri   relieved face ;pengecut;natalia hero pengecut tidak mau berani menampakkan diri relieved face
