date,username,tweet,keyword,Normalisasi
2022-06-28 07:33:38+00:00,mstaronline,sering dilihat bahagia  rupa rupanya banyak masalah dalam rumah tangga  tegar septian umum cerai dengan isteri   ,kurus,sering dilihat bahagia rupa rupanya banyak masalah dalam rumah tangga tegar septian umum cerai dengan isteri
2022-06-28 07:33:34+00:00,jjicrew,info cpt kurus tanpa stress krna ak stress mlh makan,kurus,info cepat kurus tanpa stress karena aku stress masalah makan
2022-06-28 07:33:08+00:00,hamdanT5,  nasi merah biar kurus jare,kurus,nasi merah biar kurus jare
2022-06-28 07:32:21+00:00,jungwooshock, yanan nder  ttg body positivity sih  aku yanan  mau aku gemuk  kurus  aku tetep yanan  kalo dikatain jel  ,kurus,yanan sender ttg body positivity sih aku yanan mau aku gemuk kurus aku tetep yanan kalo dikatain jel
2022-06-28 07:30:33+00:00,LurahVenus,cara cepet gemuk itu gimana  bosen kurus mulu,kurus,cara cepet gemuk itu gimana bosen kurus mulu
2022-06-28 07:29:09+00:00,natisserie, yakaann huhu udah kurus bgt sedih,kurus,yakaann huhu udah kurus banget sedih
2022-06-28 07:27:59+00:00,Muhds1Muhd, aku tahu masaalah nak kurus baik joging bagus untuk kesihatan winking face ,kurus,aku tahu masaalah mau kurus baik joging bagus untuk kesihatan winking face
2022-06-28 07:25:59+00:00,YusofShafirah,jom kurus bersama icara teh tarik vset slim  tekan link untuk order  ,kurus,jom kurus bersama icara teh tarik vset slim tekan link untuk order
2022-06-28 07:25:18+00:00,ihafizrahim,ulang hari hari tanpa perbuatan yang boleh membuatkan anda kurus  kurus bukan dengan kata kata ,kurus,ulang hari hari tanpa perbuatan yang boleh membuatkan anda kurus kurus bukan dengan kata kata
2022-06-28 08:45:03+00:00,discrepanc, lu dari awal ribut soal jelek nan gendut  gamau usaha diet kah  ini sih the real lu yang insecure oran  ,gendut,kamu dari awal ribut soal jelek nan gendut gamau usaha diet kah ini sih the real kamu yang insecure oran
2022-06-28 08:40:59+00:00,gendut_suyanto, cantik,gendut,cantik
2022-06-28 08:40:28+00:00,tomox48,nabilahjkt48 gendut ,gendut,nabilahjkt48 gendut
2022-06-28 08:36:06+00:00,budiman_markus,  loe gendut  amp  lucu banget om  ngemesin deh,gendut,kamu gendut sampai lucu banget om ngemesin deh
2022-06-28 08:35:40+00:00,gifarihwi,anda mau diet sehat dan alami tanpa olahraga ga pede sama badan gendut wmp aja solusinya more info bbm 5f1c0ca0 wa  ,gendut,anda mau diet sehat dan alami tanpa olahraga tidak pede sama badan gendut wmp aja solusinya more info bbm 5f1c0ca0 wa
2022-06-28 08:34:53+00:00,_meiharu,lucuu jimin nya gendut bgt pleading face  loudly crying face  pinching hand  purple heart  purple heart  beating heart  ,gendut,lucuu jimin nya gendut banget pleading face loudly crying face pinching hand purple heart purple heart beating heart
2022-06-28 08:34:26+00:00,eka_gendut, yg bisa pke cuma orang2 kaya  makin aneh aja kebijakannya,gendut,yang bisa pakai cuma orang2 kaya makin aneh aja kebijakannya
2022-06-28 08:34:10+00:00,HindunDiana2, apa mas  ngatain saya  iya tau saya gendut relieved face ,gendut,apa mas ngatain saya iya tau saya gendut relieved face
2022-06-28 08:33:12+00:00,zworroies,pengen mkn byk tanpa mikir kalori  tanpa takut gendut kea mkn byk tpi bb tetap gitu bsa gk njenk capekk gweehh,gendut,pengen makan benyak tanpa mikir kalori tanpa takut gendut kea makan benyak tapi berat badan tetap gitu bisa tidak njenk capekk gweehh
2022-06-28 08:32:39+00:00,dearbiyy,selamat pukul 15 32  akhirnya dear biy lahir juga di dunia    selamat menikmati dan berselancar di dunia burung biru gendut,gendut,selamat pukul 15 32 akhirnya dear biy lahir juga di dunia selamat menikmati dan berselancar di dunia burung biru gendut
2022-06-28 08:27:49+00:00,Viphoriaa__,wkwkwk lucu amat perut nya gendut  face with tears of joy  face with tears of joy  ,gendut,wkwkwk lucu amat perut nya gendut face with tears of joy face with tears of joy
2022-06-28 08:27:28+00:00,Chocoren02, demi gk perlu beli pakaian baru cuma gegara dah gk muat  soalnya w dah pernah gendut dan semua baju  ,gendut,demi tidak perlu beli pakaian baru cuma karena dah tidak muat soalnya aku dah pernah gendut dan semua baju
2022-06-28 08:26:19+00:00,wowmaskermurah,bosen di bilang gendut  jangan takut buktikan kamu bisa langsing  konsultasi ke ahlinya pin 2a882bba no 085794699654 ,gendut,bosen di bilang gendut jangan takut buktikan kamu bisa langsing konsultasi ke ahlinya pin 2a882bba no 085794699654
2022-06-28 08:21:34+00:00,koala_gendut, emang enak gaes,gendut,emang enak gaes
2022-06-28 08:19:22+00:00,vidivicia, mungkin kalau waktu itu aku ga nyukur aku ga akan tau kalau kucing aku kena hernia  bulunya emang lebat  ,gendut,mungkin kalau waktu itu aku tidak nyukur aku tidak akan tau kalau kucing aku kena hernia bulunya emang lebat
2022-06-28 08:18:51+00:00,bacotanreree,lagi iri sama krang yang demen mukbang tapi ga gendut gendut woman running light skin tone ,gendut,lagi iri sama kurang yang demen mukbang tapi tidak gendut gendut woman running light skin tone
2022-06-28 08:16:08+00:00,cop_cop05,ada b daerah cimahi yg mau fun  amp  sma t gendut  gaycimahi gaybandung gaysangkuriang,gendut,ada b daerah cimahi yang mau fun sampai sama itu gendut gaycimahi gaybandung gaysangkuriang
2022-06-28 08:16:00+00:00,DikaOceanix, perut dah gendut  tambah sexy,gendut,perut dah gendut tambah sexy
2022-06-28 08:12:12+00:00,heiclare,mampus lu gendut ,gendut,mampus kamu gendut
2022-06-28 08:10:35+00:00,ssuuggaarrxxx_,gendut bgt   pke nyebelin bgt lgi mukanny  amp  amp  amp  ,gendut,gendut banget pakai nyebelin banget lagi mukanny sampai sampai sampai
2022-06-28 08:09:29+00:00,eka_gendut, sayure  ngerti ngerti  aq kuliah jogja  jadi ngerti jadi ngerti,gendut,sayure ngerti ngerti aku kuliah jogja jadi ngerti jadi ngerti
2022-06-28 08:05:47+00:00,gifarihwi,anda mau diet sehat dan alami tanpa olahraga ga pede sama badan gendut wmp aja solusinya more info bbm 5f1c0ca0 wa  ,gendut,anda mau diet sehat dan alami tanpa olahraga tidak pede sama badan gendut wmp aja solusinya more info bbm 5f1c0ca0 wa
2022-06-28 08:05:36+00:00,dewi_bulannn, drooling face  gendut  tembem face with hand over mouth  face with hand over mouth siapa yg suka body kaya tante ,gendut,drooling face gendut tembem face with hand over mouth face with hand over mouth siapa yang suka body kaya tante
2022-06-28 08:04:43+00:00,reviewajeeeee, 2 orang definisi makan banyak tp gak gendut,gendut,2 orang definisi makan banyak tapi tidak gendut
2022-06-28 08:04:13+00:00,0xLinnss,indra bekti sebelum gendut seperti sekarang ,gendut,indra bekti sebelum gendut seperti sekarang
2022-06-28 08:03:50+00:00,kezce, gendut  nyeret  lumba ,gendut,gendut nyeret lumba
2022-06-28 08:02:54+00:00,janjaegers,sering nonton mukbang  trus mikir  ini gue makan udon semangkok kekenyangan  makan mie ayam satu porsi nyerah  pada  ,gendut,sering nonton mukbang terus mikir ini aku makan udon semangkok kekenyangan makan mie ayam satu porsi nyerah pada
2022-06-28 08:01:51+00:00,Mr_MinatoN, daripada suapan terakhir makanan selezat apapun atau diejek gendut  aku lebih tidak bisa memaafkanmu kalau kau men  ,gendut,daripada suapan terakhir makanan selezat apapun atau diejek gendut aku lebih tidak bisa memaafkanmu kalau kamu men
2022-06-28 08:01:18+00:00,gendut_shohae,anya dan anya a nya besar ,gendut,anya dan anya a nya besar
2022-06-28 08:00:26+00:00,narutolover_ID, daripada suapan terakhir makanan selezat apapun atau diejek gendut aku lebih tidak bisa memaafkanmu kalau kau menghina sahabatku   chouji,gendut,daripada suapan terakhir makanan selezat apapun atau diejek gendut aku lebih tidak bisa memaafkanmu kalau kamu menghina sahabatku chouji
2022-06-28 08:00:19+00:00,gendut_shohae, gas ngengg,gendut,gas ngengg
2022-06-28 07:57:43+00:00,bwilucu, engga kok emang jariku rada gendut jadinya kaya kekencengan  loudly crying face ,gendut,engga kok emang jariku rada gendut jadinya kaya kekencengan loudly crying face
2022-06-28 07:52:07+00:00,catulistiua, hayuu nanti main bareng aku gm,gendut,hayuu nanti main bareng aku gm
2022-06-28 07:51:36+00:00,cinzirabella, grey lebih gendut,gendut,grey lebih gendut
2022-06-28 07:49:47+00:00,hnycoww, selesein masalah sama diri kamu sendiri dulu nanti nurutin suka doang  trus malah nyiksa anak orang sama  ,gendut,selesein masalah sama diri kamu sendiri dulu nanti nurutin suka doang terus malah nyiksa anak orang sama
2022-06-28 07:48:55+00:00,catulistiua, tiernya apa ,gendut,tiernya apa
2022-06-28 07:47:05+00:00,akumahanon, sering belinya sih ayam balado ijo merah   ayam bakar  cincang gtu namanya  cumi gendut  kikil jarang si  ,gendut,sering belinya sih ayam balado ijo merah ayam bakar cincang gitu namanya cumi gendut kikil jarang si
2022-06-28 07:46:02+00:00,gendut_shohae,alias vale kntl udah maksa taunya copoo,gendut,alias vale kntl udah maksa taunya copoo
2022-06-28 07:45:29+00:00,gendut_shohae,ss dulu tempulu menang ,gendut,screenshot dulu tempulu menang
2022-06-28 07:43:26+00:00,gendut_shohae, iyah,gendut,iyah
2022-06-28 07:42:38+00:00,MarinusKaw, om  kok udah dibuka pake vpn tetep gak bisa dibuka error gt,gendut,om kok udah dibuka pake vpn tetep tidak bisa dibuka error gitu
2022-06-28 07:38:27+00:00,hilraetth,yaallah dikatain makin gendut mulu ama orang loudly crying face  loudly crying face  loudly crying face  loudly crying face  loudly crying face ,gendut,yaallah dikatain makin gendut mulu sama orang loudly crying face loudly crying face loudly crying face loudly crying face loudly crying face
2022-06-28 07:38:10+00:00,abangajhe, aku udah gendut,gendut,aku udah gendut
2022-06-28 07:37:10+00:00,bllurrp, gatau nder  ak juga kesel  padahal alasan ak gendut karena stress wakkakakaka,gendut,gatau sender aku juga kesel padahal alasan aku gendut karena stress wakkakakaka
2022-06-28 07:33:10+00:00,thaxunext,waktu masi gendut ,gendut,waktu masi gendut
2022-06-28 07:33:08+00:00,jeff_ikhlas, pendek gendut hidup lagi  rolling on the floor laughing ,gendut,pendek gendut hidup lagi rolling on the floor laughing
2022-06-28 07:30:03+00:00,heyitzwillz,orang pake oversized kok bagus2 ya  gue pake udah kyk snorlax anjir gendut bgt jadinya  loudly crying face  loudly crying face  loudly crying face  loudly crying face ,gendut,orang pake oversized kok bagus2 ya aku pake udah seperti snorlax anjing gendut banget jadinya loudly crying face loudly crying face loudly crying face loudly crying face
2022-06-28 07:29:05+00:00,EyangGOMBAL,biarpun kamu gendut  kamu tetap muat kok dihatiku,gendut,biarpun kamu gendut kamu tetap muat kok dihatiku
2022-06-28 07:28:47+00:00,TravellersID, variasi masakannya sih  yang lebih ke jawa tengah  kalau warung muslim kan lebih ke jawa timur  price p  ,gendut,variasi masakannya sih yang lebih ke jawa tengah kalau warung muslim kan lebih ke jawa timur price p
2022-06-28 07:26:12+00:00,statistikah, konsisten ala aku  nangis dan dendam dulu sama org yg ngatain aku gendut gendut gendut dan sama org yg s  ,gendut,konsisten ala aku nangis dan dendam dulu sama orang yang ngatain aku gendut gendut gendut dan sama orang yang s
2022-06-28 07:25:04+00:00,blackmambc, tapi cewek emang gitu gak sih kalau udah jadi mantan atau capek kejar cowok yg dia suka gak diconfess bal  ,gendut,tapi cewek emang gitu tidak sih kalau udah jadi mantan atau capek kejar cowok yang dia suka tidak diconfess bal
2022-06-28 07:23:10+00:00,arissuhada25, ya gendut ya ,gendut,ya gendut ya
2022-06-28 07:22:33+00:00,dreamleehi, benerr lucu2 banget ini si gendut kasein nitrat  ,gendut,benerr lucu2 banget ini si gendut kasein nitrat
2022-06-28 07:20:03+00:00,safirardia, gendut bgtt peach ,gendut,gendut banget peach
2022-06-28 07:19:56+00:00,hasibHphasibuan,  dindaa   sok ie padahal cuma bangke gendut pendek jelek ,gendut,dindaa sok ie padahal cuma bangke gendut pendek jelek
2022-06-28 07:14:38+00:00,JEJAGAT,      nah  gambaran besarnya  kodok itu gendut  pendek  dan lebar  ini bukan body shamming  ya  sayang  emang  ,gendut,nah gambaran besarnya kodok itu gendut pendek dan lebar ini bukan body shamming ya sayang emang
2022-06-28 07:13:36+00:00,bucingranger, iii aku mau diet turunin 5kg km mala mau gendut loudly crying face  ak transfer aja sini 5kg,gendut,iii aku mau diet turunin 5kg kamu mala mau gendut loudly crying face aku transfer aja sini 5kg
2022-06-28 07:12:54+00:00,kyungjunning, ditolak krn gpny kucink gendut  disappointed face  disappointed face ,gendut,ditolak karena gapunya kucing gendut disappointed face disappointed face
2022-06-28 07:12:10+00:00,icedchocolatte, nah betul  apa karena kucingku gendut ya  soalnya pernah ada kucing ras nyasar ke depan rumah  tapi  ,gendut,nah betul apa karena kucingku gendut ya soalnya pernah ada kucing ras nyasar ke depan rumah tapi
2022-06-28 07:11:45+00:00,aldereintsyaa, soalnya gendut kek bomboloni loudly crying face ,gendut,soalnya gendut seperti bomboloni loudly crying face
2022-06-28 07:10:52+00:00,AdhamRidwan, blom takut gendut,gendut,blom takut gendut
2022-06-28 07:07:00+00:00,kitkatchim,  mjb  aku bacanya bukan meng gendut tapi mengendut  maap kak,gendut,mjb aku bacanya bukan meng gendut tapi mengendut maaf kak
2022-06-28 07:04:31+00:00,gendut_shohae, mun hndak nukar coba ke pasar lama nder  pas ditikungan sebelum naik jembatan hndak ke mesjid jami tu ada,gendut,mun hendak nukar coba ke pasar lama sender ketika ditikungan sebelum naik jembatan hendak ke mesjid jami itu ada
2022-06-28 07:04:08+00:00,lanakaminisama,  fix sendernya nih,gendut,fix sendernya ini
2022-06-28 07:03:16+00:00,gendut_shohae, gech kda papa  kayanya biniannya tepikir kaya ikam jua nder,gendut,gech kda papa kayanya biniannya tepikir kaya ikam jua sender
2022-06-28 07:01:30+00:00,sauldagee,  yg pasti pasti aja ya lo,gendut,yang pasti pasti aja ya kamu
2022-06-28 07:00:32+00:00,gendut_shohae, menarik nih  di mna ,gendut,menarik ini di mana
2022-06-28 06:59:50+00:00,gendut_shohae,  bisa ke rumah masa depan  smiling face with halo  ,gendut,bisa ke rumah masa depan smiling face with halo
2022-06-28 06:59:01+00:00,FatmtlHsnh,takut makan nasi bukan karna takut gendut  tp takut muntah  frowning face  orang2 selalu bilang   gpp makan aja terus  biar seha  ,gendut,takut makan nasi bukan karena takut gendut tapi takut muntah frowning face orang2 selalu bilang tidak apa-apa makan aja terus biar seha
2022-06-28 06:57:14+00:00,JombloBaper,wanita suka pria yang gendut  gendut rekeningnya  wkwkwk   jomblo baper,gendut,wanita suka pria yang gendut gendut rekeningnya wkwkwk jomblo baper
2022-06-28 06:56:45+00:00,simplynaa2,  mun wisata masa depan am kya apa jr,gendut,mun wisata masa depan am kya apa jr
2022-06-28 06:56:41+00:00,cintaturu, mmps lo gendut,gendut,mampus kamu gendut
2022-06-28 06:54:12+00:00,FitriUnie24, temenku kurus tiap ketemu slalu ngeluh kalau dia gendut  dia gak sadar spt apa org di hadapannya   relieved face   ,gendut,temenku kurus tiap ketemu slalu ngeluh kalau dia gendut dia tidak sadar seperti apa orang di hadapannya relieved face
2022-06-28 06:54:06+00:00,gendut_shohae, wisata apa nih  mun wisata kuliner atau wisata masa lalu aku tahu ja nah,gendut,wisata apa ini mun wisata kuliner atau wisata masa lalu aku tahu aja nah
2022-06-28 06:53:33+00:00,delllaaaaaadell, ko aku makin gendut    soalnya stress makan  loudly crying face ,gendut,ko aku makin gendut soalnya stress makan loudly crying face
2022-06-28 06:53:10+00:00,gendut_shohae, moo ikut,gendut,mau ikut
2022-06-28 06:52:34+00:00,gendut_shohae, dasarnya kayatu  membasuh di bjm hujannya di bjb,gendut,dasarnya kayatu membasuh di bjm hujannya di bjb
2022-06-28 06:52:28+00:00,NcangBen,  ngomong aje loe gendut,gendut,ngomong aja kamu gendut
2022-06-28 06:51:50+00:00,ekidjun, masih gendut,gendut,masih gendut
2022-06-28 06:50:57+00:00,dewyaling, gua enggak gendut,gendut,aku enggak gendut
2022-06-28 06:49:03+00:00,LikeBreakerr,gendut ucul bangett ,gendut,gendut ucul bangett
2022-06-28 06:46:04+00:00,JKJEONR, ngakak ngaku gendut anjer,gendut,ngakak ngaku gendut anjer
2022-06-28 06:45:59+00:00,i_yoora05,doggy aja dirawat sampe gendut sama sayangku  apalagi suaminya nanti  smiling face with heart eyes  ,gendut,doggy aja dirawat sampe gendut sama sayangku apalagi suaminya nanti smiling face with heart eyes
2022-06-28 06:37:49+00:00,setyaqisya,cebol di boongin gendut  tauk ,gendut,cebol di boongin gendut tauk
2022-06-28 06:35:57+00:00,IniBudi_08,  ndilalah biyen pas gek medheng2 e thukul dirabuk karo  bapak gendut saiki jebolane akeh si  ,gendut,ndilalah biyen ketika gek medheng2 e thukul dirabuk karo bapak gendut saiki jebolane akeh si
2022-06-28 06:35:18+00:00,dezalgiz, oh pantas sampai bjb hujannya  nda maka sabtu tadi hanyar membasuh kendaraan ,gendut,oh pantas sampai bjb hujannya tidak maka sabtu tadi hanyar membasuh kendaraan
2022-06-28 06:34:57+00:00,myprivismine, sama yang gendut tu babelbas ya,gendut,sama yang gendut itu babelbas ya
2022-06-28 06:34:51+00:00,CimimoCats_, keknya badan moko mirip cimi  bulet pendek gt jadi keliatan gendut  slightly smiling face  ,gendut,sepertinya badan moko mirip cimi bulet pendek gitu jadi keliatan gendut slightly smiling face
2022-06-28 06:31:33+00:00,inggajelasbgt,ada yg keliatan nganggur tp ternyata udah kerja  ada yg keliatannya cuma gabut doang di rumah ternyata rekeningnya  ,gendut,ada yang keliatan nganggur tapi ternyata udah kerja ada yang keliatannya cuma gabut doang di rumah ternyata rekeningnya
2022-06-28 06:29:11+00:00,gendut_shohae,ritual memanggil hujan sudah dimulai ,gendut,ritual memanggil hujan sudah dimulai
2022-06-28 06:20:19+00:00,kaivanotes, hahahah grogi yah  mana meongmu  kak  makin gendut ya  ameen  semoga deh   palms up together light skin tone  hehehe namanya juga baru puber ,gendut,hahahah grogi yah mana meongmu kak makin gendut ya ameen semoga deh palms up together light skin tone hehehe namanya juga baru puber
2022-06-28 06:19:55+00:00,migugyuuu, ini bagus bgtt dulu kucingku pas masih kitten suka aku kasih makan ini dan jadi gendut bgtt mam nya banyak,gendut,ini bagus banget dulu kucingku ketika masih kitten suka aku kasih makan ini dan jadi gendut banget mam nya banyak
2022-06-28 06:14:49+00:00,ratriBE, gendut itu ga selamanya kan  bisa dirunah asal kamu niat dan konsisten  jgn jadiin gendut sbg tameng ke  ,gendut,gendut itu tidak selamanya kan bisa dirumah asal kamu niat dan konsisten jangan jadiin gendut sebagai tameng ke
2022-06-28 06:14:11+00:00,MunahKurniawan,ga urus kamu gendut,gendut,tidak urus kamu gendut
2022-06-28 06:13:18+00:00,ratriBE, km dah ngerasa pola pikirmu aneh  yuk diurai  km ngerasa ga ada kelebihan  pdhl km jg bilang banyak tem  ,gendut,kamu dah ngerasa pola pikirmu aneh yuk diurai kamu ngerasa tidak ada kelebihan padahal kamu juga bilang banyak tem
2022-06-28 06:12:30+00:00,fan4adventure,  grinning face with sweat  byk bgt  sebulan lgsg gendut,gendut,grinning face with sweat benyak banget sebulan langsung gendut
2022-06-28 06:09:06+00:00,HUNiverse_,duo hobi makan tapi ga gendut gendut     ,gendut,duo hobi makan tapi tidak gendut gendut
2022-06-28 06:05:57+00:00,Armando_christ,  gapapa gendut tetep muat di hati ku kok  smiling face ,gendut,gapapa gendut tetep muat di hati aku kok smiling face
2022-06-28 06:05:24+00:00,kidartdesign, ntah kalau aku bayar je  buat apa nak gaduh benda nak makan masuk dlm perut  gendang gendut tali  ,gendut,tidak tahu kalau aku bayar aja buat apa mau gaduh benda mau makan masuk dlm perut gendang gendut tali
2022-06-28 05:58:50+00:00,skskdktm, saya tim kalo pake oversize malah keliatan lebih gendut slightly smiling face ,gendut,saya tim kalo pake oversize malah keliatan lebih gendut slightly smiling face
2022-06-28 08:48:35+00:00,Liberalboy23,  pov gw simpelnya meminta agar orng2 kyk abigayl ini jgn begitu lgi  ,tolol,pov aku simpelnya meminta agar orang seperti abigayl ini jangan begitu lagi
2022-06-28 08:48:27+00:00,Crushpalingoke, emang udh punya dr lama tolol,tolol,emang udah punya dari lama tolol
2022-06-28 08:48:09+00:00,liez_iend, baca komen  koq banyak jg yg awet ya,tolol,baca komen kok banyak juga yang awet ya
2022-06-28 08:48:04+00:00,aladinmovic2000,  ga punya prestasi nekat nyapres  mainanya radikal radikul  buzzerrp tolol,tolol,tidak punya prestasi nekat nyapres mainanya radikal radikul buzzerrp tolol
2022-06-28 08:47:56+00:00,penikmatkudapan,bukan tolol tapi mau piknik gak punya duit  nyalain rejim  mau ganti hp duit kaga ada  lagi lagi salah rejim  dah h  ,tolol,bukan tolol tapi mau piknik tidak punya duit nyalain rejim mau ganti hp duit kaga ada lagi lagi salah rejim dah h
2022-06-28 08:47:44+00:00,KangQung,  hati2 nder earphone lu ga lama lagi jd kupu2,tolol,hati2 sender earphone kamu tidak lama lagi jadi kupu2
2022-06-28 08:47:37+00:00,vittosusetyo, cuma orang tolol yg gasuka cokelat ,tolol,cuma orang tolol yang gasuka cokelat
2022-06-28 08:47:32+00:00,kyungslo, saran wireless earphone yg 20k bang,tolol,saran wireless earphone yang 20k bang
2022-06-28 08:47:12+00:00,jaygengmo,lucu bgt gue lg menikmati hidup tbtb dituduh hate speech ke ngl nya mantannya mantan gue wkwkwkwk aduh tolol,tolol,lucu banget aku lagi menikmati hidup tiba-tiba dituduh hate speech ke ngl nya mantannya mantan aku wkwkwkwk aduh tolol
2022-06-28 08:47:09+00:00,kngdoojoon, kocak bgt anying opininy kyk org tolol,tolol,kocak banget anying opininy seperti orang tolol
2022-06-28 08:47:03+00:00,latifahdm__, gw emg tolol  ya maap,tolol,aku emang tolol ya maaf
2022-06-28 08:46:51+00:00,alisthaaa_, aku yg 9k malah trs original lagi merk oase olike dah setaun lbih  awet kok  grinning face with sweat  grinning face with sweat ,tolol,aku yang 9k malah terus original lagi merk oase olike dah setaun lbih awet kok grinning face with sweat grinning face with sweat
2022-06-28 08:46:37+00:00,gerasya8, enak ajaa lu  gw beli yang 20 00 awet ampe 2 minggu doang,tolol,enak ajaa kamu aku beli yang 20 00 awet ampe 2 minggu doang
2022-06-28 08:46:34+00:00,Stopsuggest1, tidak dengan vido,tolol,tidak dengan vido
2022-06-28 08:46:26+00:00,jstuffluhv,kok gue pny cwok tolol y,tolol,kok aku punya cowok tolol iya
2022-06-28 08:46:26+00:00,ryofahri2,    ,tolol,
2022-06-28 08:46:20+00:00,ODDLYKNOW,orang goblok otaknya pendek pdhl kl lu ngincer 1 member ya ikut sharing aja tolol ,tolol,orang goblok otaknya pendek padahal kalau kamu ngincer 1 member ya ikut sharing aja tolol
2022-06-28 08:46:15+00:00,Liberalboy23,  nggak dong tolol  kan di twit itu si abigayl menunjukkan ketidak su  ,tolol,tidak dong tolol kan di twit itu si abigayl menunjukkan ketidak su
2022-06-28 08:46:14+00:00,panggilajadila, gatau ya aku gedeg sm modelan cewe2 kek gini menye2 gajelas minta sesuatu yg aneh  ya kalo lo laper cari  ,tolol,gatau ya aku gedeg sm modelan cewe2 seperti gini menye2 gajelas minta sesuatu yang aneh ya kalo kamu laper cari
2022-06-28 08:45:39+00:00,AleVanillatte, pernah nyesel beli earphone 80k keatas eh punya adek yang harga 40k lebih awet  amp  enak bet,tolol,pernah nyesel beli earphone 80k keatas eh punya adik yang harga 40k lebih awet sampai enak bet
2022-06-28 08:45:13+00:00,N4D0NGIE,wkwkwkwkwk bisa bisanya juga nyolong gambar dari nana fansite  tolol  ,tolol,wkwkwkwkwk bisa bisanya juga nyolong gambar dari nana fansite tolol
2022-06-28 08:45:03+00:00,AleVanillatte,  pernah nyesel beli earphone 80k keatas eh punya adek yang harga 40k lebih awet  amp  enak bet,tolol,pernah nyesel beli earphone 80k keatas eh punya adik yang harga 40k lebih awet sampai enak bet
2022-06-28 08:45:02+00:00,320921K, gue merek robot cuman 30k  bagus,tolol,aku merek robot cuman 30k bagus
2022-06-28 08:45:00+00:00,yeolliyeol69, sleepcall bisa sampai 8 jam  gatau bahas apaan random  siap  dari pagi buat date  naik gojek 1 jam 15 men  ,tolol,sleepcall bisa sampai 8 jam gatau bahas apaan random siap dari pagi buat date naik gojek 1 jam 15 men
2022-06-28 08:44:51+00:00,taytawanreal,udh dikasih previlege tp masih tolol  skip  bodo amat gw lg sensi kontol ,tolol,udah dikasih previlege tapi masih tolol skip bodo amat aku lagi sensi kontol
2022-06-28 08:44:43+00:00,ggukidoll, aku beli goceng warna ungu lucu banget awet sih,tolol,aku beli goceng warna ungu lucu banget awet sih
2022-06-28 08:43:43+00:00,kurbokur,ketololan hari ini td ke indomaret udah sampe kasir dengan pedenya lupa bawa uang bawa debit alhasil balik dlu ke kosan  tolol ,tolol,ketololan hari ini tadi ke indomaret udah sampe kasir dengan pedenya lupa bawa uang bawa debit alhasil balik dlu ke kosan tolol
2022-06-28 08:43:39+00:00,wermmingscv, pernah beli harga 7k  suaranya enak sih tp ga awet,tolol,pernah beli harga 7k suaranya enak sih tapi tidak awet
2022-06-28 08:43:24+00:00,FariedAshari,  tolol lu gak kelar kelar  ,tolol,tolol kamu tidak kelar kelar
2022-06-28 08:42:31+00:00,kidbuc,perlunya polisi ampe s1 ya begini  tolol bgt anjir masa gabisa jawab pertanyaan yang ditilang    jabatannya aja kat  ,tolol,perlunya polisi ampe s1 ya begini tolol banget anjing masa gabisa jawab pertanyaan yang ditilang jabatannya aja kat
2022-06-28 08:42:29+00:00,mahardikats,klaus emang tolol ,tolol,klaus emang tolol
2022-06-28 08:42:27+00:00,sabilatetsuro, beli 40 rb gw  dan ga nyesel karena awet wkwk,tolol,beli 40 rb aku dan tidak nyesel karena awet wkwk
2022-06-28 08:42:19+00:00,FranditaR, kenapa,tolol,kenapa
2022-06-28 08:42:18+00:00,Jgn_Marah2,  thank s for infonya kak,tolol,thank s for infonya kak
2022-06-28 08:42:17+00:00,nzoura_, iya elah jujur gue capek bgt pdhl emg readersnya yg tolol halu kaga realistis  loudly crying face  loudly crying face  loudly crying face  loudly crying face  loudly crying face ,tolol,iya elah jujur aku capek banget padahal emang readersnya yang tolol halu kaga realistis loudly crying face loudly crying face loudly crying face loudly crying face loudly crying face
2022-06-28 08:42:11+00:00,pangestooo, 15k  baru seminggu udh mati sebelah,tolol,15k baru seminggu udah mati sebelah
2022-06-28 08:42:05+00:00,kimdo0younq,mff ya gw katain tolol  habisnya emang beneran tolol sih,tolol,maaf ya aku katain tolol habisnya emang beneran tolol sih
