date,username,tweet,keyword,Normalisasi
2022-06-28 08:16:50+00:00,NJMCHOU, yg penting mainnya oke  ga troll  ga ganggu kemenangan tim  itu ga beban yh sat  ga semua org bisa all ro  ,beban,yang penting mainnya oke tidak troll tidak ganggu kemenangan tim itu tidak beban yah sat tidak semua orang bisa all ro
2022-06-28 08:16:42+00:00,dincny, emang punya anak itu beban  aku belum jadi ortu  belum nikah  tp aku sadar diri ajaa face with tears of joy ,beban,emang punya anak itu beban aku belum jadi ortu belum nikah tapi aku sadar diri ajaa face with tears of joy
2022-06-28 08:48:03+00:00,ms903cte,  pengecut tuh kolak  rolling on the floor laughing ,pengecut,pengecut tuh kolak rolling on the floor laughing
2022-06-28 08:40:37+00:00,hujanawal,  pengecut opo su ,pengecut,pengecut opo su
2022-06-28 08:39:54+00:00,2komaini_ahmad4, follow akun pengecut kayak gini  min    ampun dah ,pengecut,follow akun pengecut kayak gini min ampun dah
2022-06-28 08:39:19+00:00,emie_ys,terpaling sooyaas  face vomiting  keja dia nak nasty kan orang je pelik  dok cari gaduh dengan snows dan hollies yang terang t  ,pengecut,terpaling sooyaas face vomiting keja dia mau nasty kan orang aja pelik dok cari gaduh dengan snows dan hollies yang terang itu
2022-06-28 08:37:03+00:00,illiayetrench,tapi pengecut tidak bisa menjadi begitu kuat dan menanggung kesulitan sendiri hingga saat ini  nami   one piece,pengecut,tapi pengecut tidak bisa menjadi begitu kuat dan menanggung kesulitan sendiri hingga saat ini nami one piece
2022-06-28 08:36:45+00:00,1febri,sering seringlah cemas biar paranoid sekalian sampe gila  ternyata rrc pengecut ,pengecut,sering seringlah cemas biar paranoid sekalian sampe gila ternyata rrc pengecut
2022-06-28 08:36:27+00:00,MRLofficials, mat hasan pengecut dokek orang kan main cakap bosar garang tegas  baru kena gertak dgn setiausaha zahid d  ,pengecut,mat hasan pengecut dokek orang kan main cakap bosar garang tegas baru kena gertak dengan setiausaha zahid d
2022-06-28 08:17:31+00:00,ayudalilahh,tak puas hati dgn aku bgitau lah sial  ni kau pengecut guna orang atas tarik oncall aku hahahah,pengecut,tidak puas hati dengan aku begitu lah sial ni kamu pengecut guna orang atas tarik oncall aku hahahah
2022-06-28 08:15:26+00:00,NdaRrue, orang jepang keliru nyikapin nerjemahin kalimat  itu maksudnya supaya berjuang sampe penghabisan dan b  ,pengecut,orang jepang keliru nyikapin nerjemahin kalimat itu maksudnya supaya berjuang sampe penghabisan dan b
2022-06-28 08:05:41+00:00,freyyciaa_,org paling pengecut dan paling sampah yg pernah gua liat,pengecut,orang paling pengecut dan paling sampah yang pernah aku liat
2022-06-28 07:58:09+00:00,Heru76524144,  pengecut macam zonk nggak punya cermin sih di runahnya ,pengecut,pengecut macam zonk tidak punya cermin sih di runahnya
2022-06-28 07:58:05+00:00,rosedcoloredboy, aku hanya seorang pengecut sedang jatuh hati  memberi perhatian tapi bukan kepastian   sopan kali lirik ini folded hands ,pengecut,aku hanya seorang pengecut sedang jatuh hati memberi perhatian tapi bukan kepastian sopan kali lirik ini folded hands
2022-06-28 07:42:37+00:00,aldienfit, oalaahh pengecut,pengecut,oalaahh pengecut
2022-06-28 07:37:28+00:00,historyGUE,menyatakan secara langsung lebih baik daripada menjadi pengecut yang hanya berbicara dan menjelek jelekan dibelakang    ,pengecut,menyatakan secara langsung lebih baik daripada menjadi pengecut yang hanya berbicara dan menjelek jelekan dibelakang
2022-06-28 07:36:27+00:00,Onepiece_IDN, jangan menghina shanks dan yang lain   mereka bukan pengecut     luffylaw,pengecut,jangan menghina shanks dan yang lain mereka bukan pengecut luffylaw
2022-06-28 07:32:25+00:00,whereareyouluph, goodluck mbak semoga hasilnya sesuai keinginan  salut banget sama keberaniaannya  ga kayak aku yang pen  ,pengecut,goodluck mbak semoga hasilnya sesuai keinginan salut banget sama keberaniaannya tidak kayak aku yang pengen
2022-06-28 07:32:15+00:00,readtilldied, merasa beruntung udah denger  pengecut  versi live hehehe,pengecut,merasa beruntung udah denger pengecut versi live hehehe
2022-06-28 07:27:48+00:00,KepoSeru,biar kecut  asal bukan pengecut   petualangan sherina,pengecut,biar kecut asal bukan pengecut petualangan sherina
2022-06-28 07:27:25+00:00,MariamDalila,pengecut mati banyak kali sebelum kematiannya  yang berani mati hanya sekali  mutiarakata,pengecut,pengecut mati banyak kali sebelum kematiannya yang berani mati hanya sekali mutiarakata
2022-06-28 07:22:34+00:00,thewweskywalker, keren kak  kl gua si emg pengecut aja bukan gengsi gmw confess dluan  loudly crying face ,pengecut,keren kak kalau aku si emang pengecut aja bukan gengsi gmw confess dluan loudly crying face
2022-06-28 07:20:05+00:00,binaratmaja, setengah mati diriku  setengah hati dirimu     pengecut  versi live rilis di channel youtube saya malam ini pukul  ,pengecut,setengah mati diriku setengah hati dirimu pengecut versi live rilis di channel youtube saya malam ini pukul
2022-06-28 07:14:16+00:00,heyadhy,  aku hanya seorang pengecut sedang jatuh hati  memberi perhatian tapi bukan kepastian     fiersa besa  ,pengecut,aku hanya seorang pengecut sedang jatuh hati memberi perhatian tapi bukan kepastian fiersa besa
2022-06-28 07:07:11+00:00,lexalexall, franco selena hanzo hanzo franco hero pengecut ultinya nyebelin expressionless face ,pengecut,franco selena hanzo hanzo franco hero pengecut ultinya nyebelin expressionless face
2022-06-28 07:07:00+00:00,wakidijon, hipokrit dan sikap pengecut  nda ada asap klo nda ada api,pengecut,hipokrit dan sikap pengecut tidak ada asap kalau tidak ada api
2022-06-28 07:02:31+00:00,aclassicia,orang orang yg komen seenak liurnya pake fake account  bukannya itu namanya pengecut ya ,pengecut,orang orang yang komen seenak liurnya pake fake account bukannya itu namanya pengecut ya
2022-06-28 06:51:21+00:00,ica_mhrniiii,harusnya kamu bilang aja kalo kamu udaa ada orang lain kamu uda ga sayang sama aku  perasaan ini uda basi  hubungan  ,pengecut,harusnya kamu bilang aja kalo kamu udaa ada orang lain kamu udah tidak sayang sama aku perasaan ini udah basi hubungan
2022-06-28 06:48:37+00:00,zhixinJs, berani buat  tak berani mengaku  pengecut pasangan najib aka pencuri ni ,pengecut,berani buat tidak berani mengaku pengecut pasangan najib aka pencuri ni
2022-06-28 06:42:42+00:00,mewanimine,bagi email berkajang2 just to blame me  pengecut yee kalau berani sgt nk blame aku  include lah orang lain  smiling face with horns  inclu  ,pengecut,bagi email berkajang2 just to blame me pengecut yee kalau berani sangat mau blame aku include lah orang lain smiling face with horns inclu
2022-06-28 06:41:46+00:00,txtdaritanjiro, jangan lari dasar pengecut     kamado tanjiro,pengecut,jangan lari dasar pengecut kamado tanjiro
2022-06-28 06:40:12+00:00,richoiko, natalia  hero pengecut gak mau berani menampakkan diri   relieved face ,pengecut,natalia hero pengecut tidak mau berani menampakkan diri relieved face
2022-06-28 06:36:25+00:00,mripossad,hal tercupu yaitu mencari masa dan berlindung dibalik base untuk memunculkan keributan  face with tears of joy  sorry to say lo pengecut k  ,pengecut,hal tercupu yaitu mencari masa dan berlindung dibalik base untuk memunculkan keributan face with tears of joy sorry to say kamu pengecut k
2022-06-28 06:33:01+00:00,darenboys23,  lapor ke pangdam jaya aja  mrka brani  ga pengecut kyk si itu ,pengecut,lapor ke pangdam jaya aja mereka berani tidak pengecut seperti si itu
2022-06-28 06:32:00+00:00,BillTemporo,fpi pengecut  gak berani jihad ke ambon ,pengecut,fpi pengecut tidak berani jihad ke ambon
2022-06-28 06:31:39+00:00,Metarubrisit7nd, biasa yg kek gitu pengecut gaberani di akunnya sendiri  jadilah di base bikin ricuh ,pengecut,biasa yang seperti gitu pengecut gaberani di akunnya sendiri jadilah di base bikin ricuh
2022-06-28 06:29:53+00:00,mripossad, pengecut kan gitu maennya dibase lachh,pengecut,pengecut kan gitu maennya dibase lachh
2022-06-28 06:29:28+00:00,_readandread,kalau emang jiu mau pergi  gpp  dia ngga sepenuhnya salah karena dari awal juga joe ga pernah berani ngomong yg sej  ,pengecut,kalau emang jiu mau pergi tidak apa-apa dia tidak sepenuhnya salah karena dari awal juga joe tidak pernah berani ngomong yang sej
2022-06-28 06:29:06+00:00,mutakhirr,seorang yang berani akan lebih baik daripada ribuan pengecut ,pengecut,seorang yang berani akan lebih baik daripada ribuan pengecut
2022-06-28 06:13:45+00:00,MasBay1898,  bacoot loe  share lok aja jangan jadi pecundang dan pengecut,pengecut,bacoot kamu share lok aja jangan jadi pecundang dan pengecut
2022-06-28 06:04:32+00:00,muzzayyinzany,percuma aja lo cakep kalo ga punya harga diri  d4rkbot giliran didepan gaberani kalo diblkg ngmgin  ha ha pengecut     d4rkbot,pengecut,percuma aja kamu cakep kalo tidak punya harga diri d4rkbot giliran didepan gaberani kalo diblkg ngmgin ha ha pengecut d4rkbot
2022-06-28 05:57:54+00:00,Hariss_FZ,  haiyah pake akun pengecut lagak lu sok  jago,pengecut,haiyah pake akun pengecut lagak kamu sok jago
2022-06-28 05:55:26+00:00,ihwaumrrh4, pas kemaren nnton konser  bapaknya si neng bawain lagu pengecut  pdhl pengecutnya nonton konser bareng ogutt   ,pengecut,ketika kemaren nnton konser bapaknya si neng bawain lagu pengecut padahal pengecutnya nonton konser bareng ogutt
2022-06-28 05:55:15+00:00,godham5, muskoplak laki2 pengecut se nusantara  thinking face   krn ketika dia b masalah dgn hukum  atas p buatannya s  ,pengecut,muskoplak laki2 pengecut se nusantara thinking face karena ketika dia b masalah dengan hukum atas p buatannya s
2022-06-28 05:51:35+00:00,efrinasarivs,aku tak berani menutup mata  sekadar memimpikan kita bersama pun aku tak berani apalagi ketika kubuka mataku  aku t  ,pengecut,aku tidak berani menutup mata sekadar memimpikan kita bersama pun aku tidak berani apalagi ketika kubuka mataku aku itu
2022-06-28 05:34:17+00:00,ans_steph,  mental pengecut sih  menggantungkan kebahagiaan sama 1 orang  yg kalo lepas depresi  trus b  ,pengecut,mental pengecut sih menggantungkan kebahagiaan sama 1 orang yang kalo lepas depresi terus b
2022-06-28 05:26:24+00:00,Eritrosith, sebuah kenyataan yang berkata kalau hidup tidak akan pernah sempurna  karena hanya seorang pengecut yg mengharapkan hidup yg sempurna  ,pengecut,sebuah kenyataan yang berkata kalau hidup tidak akan pernah sempurna karena hanya seorang pengecut yang mengharapkan hidup yang sempurna
2022-06-28 05:22:58+00:00,Abahozan1, mang lu pinter  lu bukan cuma tolol dan goblog lu juga juga bencong pengecut  ngomong sok  ,pengecut,mang kamu pinter kamu bukan cuma tolol dan goblog kamu juga juga bencong pengecut ngomong sok
2022-06-28 05:18:31+00:00,oshblossom, main playing victim entar biar kaum meki pada dateng pengecut,pengecut,main playing victim entar biar kaum meki pada dateng pengecut
2022-06-28 05:16:38+00:00,ikanuraini_nov,sumpeh  gue kayanya makin benci sama lu  org paling tolol  goblok  pengecut yg pernah gue kenal  banyak bacot but n  ,pengecut,sumpeh aku kayanya makin benci sama kamu orang paling tolol goblok pengecut yang pernah aku kenal banyak bacot but dan
2022-06-28 05:16:36+00:00,syafiqsrzn,  orang macamni jenis melayu pengecut  depan2 goyang  belakang2 berani  percayalah bil  ,pengecut,orang macamni jenis melayu pengecut depan2 goyang belakang2 berani percayalah bil
2022-06-28 05:08:37+00:00,LeembuJ,  beaming face with smiling eyes  beaming face with smiling eyes  beaming face with smiling eyes  beaming face with smiling eyes pengecut dia,pengecut,beaming face with smiling eyes beaming face with smiling eyes beaming face with smiling eyes beaming face with smiling eyes pengecut dia
2022-06-28 05:05:47+00:00,seungk_17,menurutku aku yang paling pengecut diantara temen ku  mereka semua hebat keren lah pokoknya  tapi aku  stuck   ngga ada perkembangan apapun,pengecut,menurutku aku yang paling pengecut diantara temen aku mereka semua hebat keren lah pokoknya tapi aku stuck tidak ada perkembangan apapun
2022-06-28 05:05:08+00:00,starkun_tk,ishida kun   seseorang yg menindas yg lemah karena tidak mampu melawan yg kuat  lebih pantas disebut pengecut  bleach syquote,pengecut,ishida kun seseorang yang menindas yang lemah karena tidak mampu melawan yang kuat lebih pantas disebut pengecut bleach syquote
2022-06-28 05:02:51+00:00,Fido_id_,  bener bro  pemerintah usa pengecut  beraninya menggunakan tangan tangan orang untuk menghukum n  ,pengecut,bener bro pemerintah usah pengecut beraninya menggunakan tangan tangan orang untuk menghukum dan
2022-06-28 04:57:08+00:00,Utux22Sedana, pengecut lu ga punya nyali sama keq kaum lu yg sampah akwkaa  face vomiting  face vomiting  face vomiting  face vomiting ,pengecut,pengecut kamu tidak punya nyali sama seperti kaum kamu yang sampah akwkaa face vomiting face vomiting face vomiting face vomiting
2022-06-28 04:56:06+00:00,xxrealminos, maaf joji tp aku dah ganti haluan kayaknya pengecut siap buat di play berkali2 mengiringi ovt tiap malam  ,pengecut,maaf joji tapi aku dah ganti haluan kayaknya pengecut siap buat di play berkali2 mengiringi ovt tiap malam
2022-06-28 04:54:23+00:00,KittiaKuroKuro,seseorang yang menindas yang lemah karena tidak bisa menang melawan yang kuat  lebih pantas disebut pengecut   ishida   bleach  bot,pengecut,seseorang yang menindas yang lemah karena tidak bisa menang melawan yang kuat lebih pantas disebut pengecut ishida bleach bot
2022-06-28 04:47:11+00:00,vhebi_639,menyerah sebelum berusaha itu namanya pengecut,pengecut,menyerah sebelum berusaha itu namanya pengecut
2022-06-28 04:46:16+00:00,thinkerbellee2,kok bisa ya ada cowo yg sopan santunnya 0 banget   kasar ke cewek  tukang kompor  banyak gaya  sombong ngga punya a  ,pengecut,kok bisa ya ada cowo yang sopan santunnya 0 banget kasar ke cewek tukang kompor banyak gaya sombong tidak punya a
2022-06-28 04:42:13+00:00,dedektriwidodo,lihat baik baik perbedaan nya  banyak sekali keburukan menyerupai kebaikan  pengecut menyerupai kehati hatian  jang  ,pengecut,lihat baik baik perbedaan nya banyak sekali keburukan menyerupai kebaikan pengecut menyerupai kehati hatian jang
2022-06-28 04:40:25+00:00,kawalkyai, getir   narasi kekalahan bagi yang merasa dirinya seharusnya berkuasa tapi kok ya kalah bisa terasa luar biasa get  ,pengecut,getir narasi kekalahan bagi yang merasa dirinya seharusnya berkuasa tapi kok ya kalah bisa terasa luar biasa get
2022-06-28 04:30:47+00:00,tonizno11, jangan lari dasar pengecut     kamado tanjiro,pengecut,jangan lari dasar pengecut kamado tanjiro
2022-06-28 04:29:12+00:00,mconeforall, beraninya main kepung  duel luh  kalo berani  dasar mbak mu pengecut ,pengecut,beraninya main kepung duel luh kalo berani dasar mbak mu pengecut
2022-06-28 04:27:12+00:00,PutraRa33763114,    ,pengecut,
2022-06-28 04:26:55+00:00,Pemuda91243306, bekingnya pengecut hahahaha,pengecut,bekingnya pengecut hahahaha
2022-06-28 04:22:57+00:00,Paramecwara,holywings ni  manajemennya udah pun ill mannered  pengecut pula ,pengecut,holywings ni manajemennya udah pun ill mannered pengecut pula
2022-06-28 04:21:02+00:00,ariyanto9993,bukannya hanya pengecut tapi juga munafik  ,pengecut,bukannya hanya pengecut tapi juga munafik
2022-06-28 04:15:25+00:00,mnusiabodoh_,  aku hanya seorang pengecut sedang jatuh hati  memberi perhatian tapi bukan kepastian  ,pengecut,aku hanya seorang pengecut sedang jatuh hati memberi perhatian tapi bukan kepastian
2022-06-28 04:14:53+00:00,CallMEdoel, mo keturunan atau bukan  yg namanya pengecut ya pengecut  pion dijadiin tumbal ,pengecut,mau keturunan atau bukan yang namanya pengecut ya pengecut pion dijadiin tumbal
2022-06-28 04:08:47+00:00,BryokAceh, satu kata pengecut,pengecut,satu kata pengecut
2022-06-28 04:05:29+00:00,bkngagamuhamad,aku hanya seorang pengecut yang sedang jatuh hati memberi perhatian tapi bukan kepastian ,pengecut,aku hanya seorang pengecut yang sedang jatuh hati memberi perhatian tapi bukan kepastian
2022-06-28 04:05:16+00:00,sadpiness_, setelah  april  kayaknya  pengecut  ini jadi lagu favorit deh,pengecut,setelah april kayaknya pengecut ini jadi lagu favorit deh
2022-06-28 03:56:36+00:00,myself_ddd, stress tuh org wkwk iri blg boss  pengecut bgt,pengecut,stress tuh orang wkwk iri blg boss pengecut banget
2022-06-28 03:56:21+00:00,Chokieee_, boro boro bilang suka  yang suka ajah gak ada  pengecut,pengecut,boro boro bilang suka yang suka ajah tidak ada pengecut
2022-06-28 03:54:40+00:00,FiersaBesari, setengah mati diriku  setengah hati dirimu     pengecut  versi live rilis di channel youtube saya malam ini pukul  ,pengecut,setengah mati diriku setengah hati dirimu pengecut versi live rilis di channel youtube saya malam ini pukul
2022-06-28 03:54:28+00:00,wansahbilal,  tdk menunjukkan identitas tp bersuara sama saja pengecut  manusia lemah,pengecut,tidak menunjukkan identitas tapi bersuara sama saja pengecut manusia lemah
2022-06-28 03:50:06+00:00,Ibra_brahmana,  liat nihh jg  cebong2 anarkis  tukang rusuh  bodoh  pengecut  ,pengecut,liat nihh juga cebong2 anarkis tukang rusuh bodoh pengecut
2022-06-28 03:49:05+00:00,twiceter_,lo tuh pengecut tau ga  gamau ambil pilihan tapi gamau salah juga kalo pake pilihan orang lain,pengecut,kamu tuh pengecut tau tidak gamau ambil pilihan tapi gamau salah juga kalo pake pilihan orang lain
2022-06-28 03:47:53+00:00,TxtFromMando,  org2 itu cuma minta 1 org dihukum  keroyokan pengecut  dan a  ,pengecut,org2 itu cuma minta 1 orang dihukum keroyokan pengecut dan a
2022-06-28 03:46:05+00:00,stfudoyie, pengecut loehh jey ,pengecut,pengecut loehh jey
2022-06-28 03:45:32+00:00,bagas_refaldi,ciri ciri pengecut  ,pengecut,ciri ciri pengecut
2022-06-28 03:45:12+00:00,anggadoxx,  2019 ganti presiden   inkonstitusional  sampe kaosnya aja dilarang   2024 jokowi lanjut   a  ,pengecut,2019 ganti presiden inkonstitusional sampe kaosnya aja dilarang 2024 jokowi lanjut a
2022-06-28 03:37:33+00:00,AlanAla63203107, bilang aja kalian takut anies jadi presiden  dasar pengecut,pengecut,bilang aja kalian takut anies jadi presiden dasar pengecut
2022-06-28 03:37:21+00:00,inyong_nae,pengecut ni sender yg ngirim i hv crush on u,pengecut,pengecut ni sender yang ngirim i hv crush on kamu
2022-06-28 03:36:47+00:00,annisasa435,ansor berlindung dibalik nama besar nu  pengecut ansor  ini negara hukum  bukan negra bapak kalian  ini jg bukan ne  ,pengecut,ansor berlindung dibalik nama besar nu pengecut ansor ini negara hukum bukan negra bapak kalian ini juga bukan ne
2022-06-28 03:24:21+00:00,Fans_of_Conan,seseorang yang menindas yang lemah karena tidak bisa menang melawan yang kuat  lebih pantas disebut pengecut   ishida   bleach  animequote,pengecut,seseorang yang menindas yang lemah karena tidak bisa menang melawan yang kuat lebih pantas disebut pengecut ishida bleach animequote
2022-06-28 03:18:36+00:00,ekoperasetyo, kkb pengecut   berani sama yg ga punya senjata,pengecut,kkb pengecut berani sama yang tidak punya senjata
2022-06-28 03:18:32+00:00,ekoperasetyo, kkb pengecut   berani sama yg ga punya senjata,pengecut,kkb pengecut berani sama yang tidak punya senjata
2022-06-28 03:16:59+00:00,RahmanKhairr,lepas tengok filem mat kilau ni  makin aku sedar kekayaan yang british kecapi sekarang pastinya mostly daripada apa  ,pengecut,lepas tengok filem mat kilau ni makin aku sedar kekayaan yang british kecapi sekarang pastinya mostly daripada apa
2022-06-28 03:09:58+00:00,jgndiliat_,wkekw siapa pengecut ini,pengecut,wkekw siapa pengecut ini
2022-06-28 03:06:56+00:00,yhanikim, orang bisa menjadi pengecut krna dia memiliki seseorang yang harus dia lindungi   sungkyunkwan scandal ,pengecut,orang bisa menjadi pengecut karena dia memiliki seseorang yang harus dia lindungi sungkyunkwan scandal
2022-06-28 03:06:47+00:00,SitiBadriahAh, lelaki buat wanita nangis  itu lelaki pengecut     lelaki dibuat nangis wanita  itu lelaki cemen    nggak adil ya   d,pengecut,lelaki buat wanita nangis itu lelaki pengecut lelaki dibuat nangis wanita itu lelaki cemen tidak adil ya d
2022-06-28 03:06:07+00:00,sukidanik,tweet nya gue hapus karena udah gak kondusif sampe ada yg bilang gue tolol wkwk panggil gue pengecut tapi sekali la  ,pengecut,tweet nya aku hapus karena udah tidak kondusif sampe ada yang bilang aku tolol wkwk panggil aku pengecut tapi sekali la
2022-06-28 03:03:44+00:00,SaintIsSun1, pelaku uda kabur say  biasaa  playing victim   rolling on the floor laughing  rolling on the floor laughing  rolling on the floor laughing  tipe pengecut  pas minger berdatangan malah kabur  ,pengecut,pelaku udah kabur say biasaa playing victim rolling on the floor laughing rolling on the floor laughing rolling on the floor laughing tipe pengecut ketika minger berdatangan malah kabur
2022-06-28 03:02:02+00:00,fuadnoer12,  pemimpin pengecut,pengecut,pemimpin pengecut
2022-06-28 03:00:32+00:00,CallMEdoel, namanya doang koh brillian   orangnya ga smart apalagi brilliant  wkwkwkwkwk pengecut taek ,pengecut,namanya doang koh brillian orangnya tidak smart apalagi brilliant wkwkwkwkwk pengecut taek
2022-06-28 03:00:01+00:00,RuhamaDiaz,cinta mengubah kekasaran menjadi kelembutan  mengubah pengecut menjadi pemberani  mengubah penderitaan menjadi keba  ,pengecut,cinta mengubah kekasaran menjadi kelembutan mengubah pengecut menjadi pemberani mengubah penderitaan menjadi keba
2022-06-28 03:00:00+00:00,DimasAnugrahe,cinta mengubah kekasaran menjadi kelembutan  mengubah pengecut menjadi pemberani  mengubah penderitaan menjadi keba  ,pengecut,cinta mengubah kekasaran menjadi kelembutan mengubah pengecut menjadi pemberani mengubah penderitaan menjadi keba
2022-06-28 03:00:00+00:00,suryadinanaa,cinta mengubah kekasaran menjadi kelembutan  mengubah pengecut menjadi pemberani  mengubah penderitaan menjadi keba  ,pengecut,cinta mengubah kekasaran menjadi kelembutan mengubah pengecut menjadi pemberani mengubah penderitaan menjadi keba
2022-06-28 02:59:28+00:00,ekoperasetyo, kkb pengecut   berani sama yang ga punya senjata,pengecut,kkb pengecut berani sama yang tidak punya senjata
2022-06-28 02:59:23+00:00,ekoperasetyo, kkb pengecut   berani sama yang ga punya senjata,pengecut,kkb pengecut berani sama yang tidak punya senjata
2022-06-28 08:46:51+00:00,AshAvril,kalau kau rasa aku rate matkilau tinggi sebab aku penyokong tegar sy kau silap  akulah manusia yang paling skeptik  ,munafik,kalau kamu rasa aku rate matkilau tinggi sebab aku penyokong tegar aku kamu khilaf akulah manusia yang paling skeptik
2022-06-28 08:43:27+00:00,CepCobra, ha2 takut ya ama anis hitam dan putih itu jelas  yg bahaya itu yg abu2   orang2 munafik wk2,munafik,ha2 takut ya sama anis hitam dan putih itu jelas yang bahaya itu yang abu2 orang2 munafik wk2
2022-06-28 08:42:58+00:00,masbarno, halaah munafik loe ris,munafik,halaah munafik kamu ris
2022-06-28 08:40:48+00:00,ras_elase, bercakap akhirat  kubur  padang mahsyar  syurga  neraka bagai  ini yang kau follow  malulah wei   ,munafik,bercakap akhirat kubur padang mahsyar syurga neraka bagai ini yang kamu follow malulah wei
2022-06-28 08:40:32+00:00,AruziMunthe, slam ktp itu gus  atau islam yg munafik  kalo islam yg baik tk mgkin makan daging babi  hayoo ngomongin siapa kau ,munafik,slam ktp itu gus atau islam yang munafik kalo islam yang baik tk mgkin makan daging babi hayoo ngomongin siapa kamu
2022-06-28 08:39:51+00:00,taecentil, munafik mrk mah,munafik,munafik mereka mah
2022-06-28 08:39:25+00:00,ibnurus86968784,  ini memg negeri nya para manusia munafik dan otak koruptor,munafik,ini memang negeri nya para manusia munafik dan otak koruptor
2022-06-28 08:37:35+00:00,syaiful_4796,lebih baik di benci dari pada munafik hanya untuk di sukai orang ,munafik,lebih baik di benci dari pada munafik hanya untuk di sukai orang
2022-06-28 08:37:16+00:00,KingOfLipServis, elo sujud ma tuhan lo sedangkan 23 jam dan 55 menit lo sembah sujud dan memuji penipu macam   ,munafik,kamu sujud ma tuhan kamu sedangkan 23 jam dan 55 menit kamu sembah sujud dan memuji penipu macam
2022-06-28 08:35:35+00:00,purnamaku4,aku ga munafik kalo aku doyan  tapi hey ada waktunya dan ada tempatnya  ga mungkin baru kenal trus aku langsung men  ,munafik,aku tidak munafik kalo aku doyan tapi hey ada waktunya dan ada tempatnya tidak mungkin baru kenal terus aku langsung men
2022-06-28 08:32:40+00:00,Sigmahalim,  bagi gerombolan anti islam  tindakan itu pas  ,munafik,bagi gerombolan anti islam tindakan itu ketika
2022-06-28 08:31:06+00:00,Syedzaf76488714, ansare sb aap ek  munafik janet ke adme han aur munafikat ke inteha per han  state bank imf ke contro  ,munafik,ansare sb aap ek munafik janet ke adme han aur munafikat ke inteha per han state bank imf ke contro
2022-06-28 08:28:38+00:00,IkhsanSumitro, itulah yg namanya munafik,munafik,itulah yang namanya munafik
2022-06-28 08:27:43+00:00,Rockgar12, giliran terpuruk langsung bohong lagi  dasar munafik ,munafik,giliran terpuruk langsung bohong lagi dasar munafik
2022-06-28 08:26:24+00:00,sultanoftasik, antara munafik pasal wayang  dia ni lah,munafik,antara munafik pasal wayang dia ni lah
2022-06-28 08:25:33+00:00,_4iiiii_naaaaaa, partaiknya paling keras bencinya setengah mati sama parpol yg maling  kasus sapi  kalau benci jangan k  ,munafik,partaiknya paling keras bencinya setengah mati sama parpol yang maling kasus sapi kalau benci jangan k
2022-06-28 08:22:52+00:00,takalokka,jangan sampai tampilan sudah baik tapi hati masih munafik karena allah melihat ikhlasnya hati  bukan sucinya penampilan fisik ,munafik,jangan sampai tampilan sudah baik tapi hati masih munafik karena allah melihat ikhlasnya hati bukan sucinya penampilan fisik
2022-06-28 08:21:24+00:00,planetwarok,  ane jg gak ada kepentingan apa2 atas tahta pak anis  ane gak minum miras  ane termasuk yg be  ,munafik,saya juga tidak ada kepentingan apa2 atas tahta pak anis saya tidak minum miras saya termasuk yang be
2022-06-28 08:20:35+00:00,uniemara,  eeehh  gue sengaja beli 5 hp buatan kapir loh  tujuannye u  ,munafik,eeehh aku sengaja beli 5 hp buatan kapir loh tujuannye kamu
