date,username,tweet,keyword,Normalisasi
2022-06-28 08:36:56+00:00,cacasbakery,  iyaa dulu banyak banget  dulu banyakan whatsapp fake sih  beneran yang bejejer jej  ,gagal,iyaa dulu banyak banget dulu banyakan whatsapp fake sih beneran yang bejejer jej
2022-06-28 08:36:55+00:00,f4irychaco,teruntuk diriku sendiri  jangan pernah bandingkan dirimu dengan orang lain kamu punya keistimewaan sendiri dan jang  ,gagal,teruntuk diriku sendiri jangan pernah bandingkan dirimu dengan orang lain kamu punya keistimewaan sendiri dan jang
2022-06-28 08:36:39+00:00,poutynu, pake paypal yaa  kayanya emang lagi engga bener deh soalnya tadi admin go pake paypal juga gagal terus,gagal,pake paypal yaa kayanya emang lagi engga bener deh soalnya tadi admin go pake paypal juga gagal terus
2022-06-28 08:36:36+00:00,Steave2093, min kok tiap mau upgrade ovo premier gagal terus pas mau scan wajah crash mulu nih appsnya  fixing dong,gagal,min kok tiap mau upgrade ovo premier gagal terus ketika mau scan wajah crash mulu ini appsnya fixing dong
2022-06-28 08:36:25+00:00,GanggangNavy,gagal hidup sehat face with steam from nose ,gagal,gagal hidup sehat face with steam from nose
2022-06-28 08:36:22+00:00,xxiaomg,tapi kayanya berat ya kalau mau naikkin harga pertalite  itukan kebijakan yg ngga populis  hahaha  negara udh gagal  ,gagal,tapi kayanya berat ya kalau mau naikkin harga pertalite itukan kebijakan yang tidak populis hahaha negara udah gagal
2022-06-28 08:35:47+00:00,otaloohc,   special delivery  kehidupan jang eun ha  kurir pengantar paket khusus yang tidak pernah gagal dalam melakukan mi  ,gagal,special delivery kehidupan jang eun ha kurir pengantar paket khusus yang tidak pernah gagal dalam melakukan mi
2022-06-28 08:35:11+00:00,bluebberryy_, anjrit wkwk produk gagal ngevlog  loudly crying face ,gagal,anjing wkwk produk gagal ngevlog loudly crying face
2022-06-28 08:35:06+00:00,starkun_tk,yukino  banyak orang gagal karena mereka tidak memahami usaha yang diperlukan untuk menjadi sukses  oregairu syquote,gagal,yukino banyak orang gagal karena mereka tidak memahami usaha yang diperlukan untuk menjadi sukses oregairu syquote
2022-06-28 08:35:02+00:00,Putri_Kirana46,orang sukses selalu kelebihan cara   namun orang gagal selalu kelebihan alasan,gagal,orang sukses selalu kelebihan cara namun orang gagal selalu kelebihan alasan
2022-06-28 08:34:36+00:00,Ikipal_,1 kesalahan yg saya lakukan hari ini adalah  ada nyamuk yg bisa lolos dari keplakan tangan saya  itu artinya saya t  ,gagal,1 kesalahan yang saya lakukan hari ini adalah ada nyamuk yang bisa lolos dari keplakan tangan saya itu artinya saya itu
2022-06-28 08:34:30+00:00,axel_zeed, halloo juga    true sangat  asalkan kita ada kemauan pasti selalu ada jalannya  lebih baik menyesa  ,gagal,halloo juga true sangat asalkan kita ada kemauan pasti selalu ada jalannya lebih baik menyesa
2022-06-28 08:34:30+00:00,powerenjher,udah bikin adonan starter kurang lebih 18jam malah gatot alias gagal total gara gara lupa nambahin gula plus keding  ,gagal,udah bikin adonan starter kurang lebih 18jam malah gatot alias gagal total gara gara lupa nambahin gula plus keding
2022-06-28 08:34:18+00:00,hqoyeon,  percobaan gagal  sg aha dah lah,gagal,percobaan gagal sg aha dah lah
2022-06-28 08:34:08+00:00,VivineAbdulah,orang sukses selalu kelebihan cara   namun orang gagal selalu kelebihan alasan,gagal,orang sukses selalu kelebihan cara namun orang gagal selalu kelebihan alasan
2022-06-28 08:33:44+00:00,txtdrcars,wkwkw puding gagal aih,gagal,wkwkw puding gagal aih
2022-06-28 08:33:31+00:00,demonmond, selamat siang  saya mau tanya kenapa di djp online saya mau download e form 2018 1770 selalu gagal und  ,gagal,selamat siang saya mau tanya kenapa di djp online saya mau download e form 2018 1770 selalu gagal und
2022-06-28 08:33:27+00:00,kloning_gagal, ko ganteng bangett,gagal,ko ganteng bangett
2022-06-28 08:33:24+00:00,2Fe2O3_3H2O,dichat oa linenya apakah pendaftarannya gagal bila lewat penutupan malah cuma dijawab akan diteruskan ke pihak terk  ,gagal,dichat oa linenya apakah pendaftarannya gagal bila lewat penutupan malah cuma dijawab akan diteruskan ke pihak terk
2022-06-28 08:33:03+00:00,Ez_inside,tidak ada kata gagal  yg ada hny belajar  semakin bnyk gagal  semakin berpengalaman ,gagal,tidak ada kata gagal yang ada hny belajar semakin banyak gagal semakin berpengalaman
2022-06-28 08:31:52+00:00,ESKOPIHITAMANIS, gagal terus ,gagal,gagal terus
2022-06-28 08:31:35+00:00,hafizotaksata, aku gagal motor time jpj  sebab jatuh titian cinta,gagal,aku gagal motor time jpj sebab jatuh titian cinta
2022-06-28 08:31:32+00:00,panggilrayen, galau   gagal galau,gagal,galau gagal galau
2022-06-28 08:31:30+00:00,AlzaIchsanK, pas coba register otp bermasalah  typing otp bermasalah  lanjut lgi pas berhasil malah tolong call cs karna gagal regist ,gagal,ketika coba register otp bermasalah typing otp bermasalah lanjut lagi ketika berhasil malah tolong call cs karena gagal regist
2022-06-28 08:31:27+00:00,cindyabella07,jika anda masih belum pernah gagal lagi  demi kebaikan pekerjaan barangkali anda perlu mengalaminya hargagpstrackergpstracker,gagal,jika anda masih belum pernah gagal lagi demi kebaikan pekerjaan barangkali anda perlu mengalaminya hargagpstrackergpstracker
2022-06-28 08:31:23+00:00,anggahandika20,  sudah mass  agak paham maksut  disini apa  tentang politik yakan  aku gab  ,gagal,sudah mass agak paham maksut disini apa tentang politik yakan aku gab
2022-06-28 08:30:57+00:00,thebaristalady,  coba daftar aplikasinya aja gagal terus gmn mau di pake deh    ,gagal,coba daftar aplikasinya aja gagal terus bagaimana mau di pake deh
2022-06-28 08:30:56+00:00,GugunDepan,kamu tak akan sukses jika tak pernah gagal  tak akan bahagia jika tak sedih  dan tak temukan cinta sejati jika tak patah hati ,gagal,kamu tidak akan sukses jika tidak pernah gagal tidak akan bahagia jika tidak sedih dan tidak temukan cinta sejati jika tidak patah hati
2022-06-28 08:30:46+00:00,Ozaa_sajaa,gua mulai sendiri  gua sengsara sendiri gua gagal sendiri dan gua bakal sukses sendiri ,gagal,aku mulai sendiri aku sengsara sendiri aku gagal sendiri dan aku bakal sukses sendiri
2022-06-28 08:30:34+00:00,skayangku,  aku gk ngutuk rezeki dia  cuman kalau tau apa yg aku laluin setahun ini jg susa  ,gagal,aku tidak ngutuk rezeki dia cuman kalau tau apa yang aku laluin setahun ini juga susa
2022-06-28 08:48:44+00:00,iis_teguh,diduga tidak kuat menahan beban keluarga seorang ayah nekat menyewa kuli panggul pasar ,beban,diduga tidak kuat menahan beban keluarga seorang ayah nekat menyewa kuli panggul pasar
2022-06-28 08:48:29+00:00,twinshinobiy, kalo angkat beban jadi olahrga,beban,kalo angkat beban jadi olahrga
2022-06-28 08:48:10+00:00,DloveTaehyung,ini klo i gaada kyanya org rumah pada bahagia deh kyanya beban nya hilang,beban,ini kalau i gaada kyanya orang rumah pada bahagia deh kyanya beban nya hilang
2022-06-28 08:48:05+00:00,Muinjeong, yuk syg tapi aku beban,beban,yuk sayang tapi aku beban
2022-06-28 08:47:51+00:00,IDESFAEGER,          tsk   adara berdecak kala ceritanya dianggap sebagai dongeng anak anak  setidaknya  keha  ,beban,tsk adara berdecak kala ceritanya dianggap sebagai dongeng anak anak setidaknya keha
2022-06-28 08:47:09+00:00,timeipu,blm 20 tpi beban idup byk beut ajgg,beban,blm 20 tapi beban idup benyak banget anjing
2022-06-28 08:47:07+00:00,semogakayaaa,dan akhirnya beban tanggungan 1 terselesaikan ,beban,dan akhirnya beban tanggungan 1 terselesaikan
2022-06-28 08:45:26+00:00,kladestiny, hadeh gasadar klo dirinya jg beban,beban,hadeh gasadar kalau dirinya juga beban
2022-06-28 08:44:58+00:00,jvunqkoq,kalau chara rare nya emang nyaman buat dibawain ga beban suka aja ,beban,kalau chara rare nya emang nyaman buat dibawain tidak beban suka aja
2022-06-28 08:44:24+00:00,rnsdee,kita remaja yg sedang dimabuk beban hidup,beban,kita remaja yang sedang dimabuk beban hidup
2022-06-28 08:44:13+00:00,NajahHajazy,tahukah anda   semut dapat mengangkat beban 50 kali tubuhnya,beban,tahukah anda semut dapat mengangkat beban 50 kali tubuhnya
2022-06-28 08:44:07+00:00,swiss_dewi1,kalau dipikir pikir ternyata beban ini banyak banget yaa  gak habis pikir slightly smiling face ,beban,kalau dipikir pikir ternyata beban ini banyak banget yaa tidak habis pikir slightly smiling face
2022-06-28 08:43:20+00:00,druigsjacket, go 6jt les private 9jt quipper 500k eduka 100k wangsit 200k gundar 12jt   untung balik nnti   ukt 6jt loudly crying face   ,beban,go 6jt les private 9jt quipper 500k eduka 100k wangsit 200k gundar 12jt untung balik  nanti ukt 6jt loudly crying face
2022-06-28 08:42:26+00:00,Celilurbae, magesup doang   beban pikiran dr mana tu anjeng,beban,magesup doang beban pikiran dari mana itu anjeng
2022-06-28 08:42:21+00:00,opnnnpan,tolong lah  loudly crying face  loudly crying face  gak usah nambah nambahin beban idup ,beban,tolong lah loudly crying face loudly crying face tidak usah nambah nambahin beban idup
2022-06-28 08:42:12+00:00,CarelineSesb,jangan sesekali letakkan beban berlebihan pada soket  demi keselamatan anda  lebih baik anda hanya menggunakan satu  ,beban,jangan sesekali letakkan beban berlebihan pada soket demi keselamatan anda lebih baik anda hanya menggunakan satu
2022-06-28 08:41:59+00:00,bollychiious, mang yg tdi beban ,beban,mang yang tadi beban
2022-06-28 08:41:48+00:00,itsmeilifluous,capek hidup cuma jadi sapi perah tapi dikatain beban ,beban,capek hidup cuma jadi sapi perah tapi dikatain beban
2022-06-28 08:41:47+00:00,mayumipedasenak,pernah diposisi dicari walaupun cuma itu itu aja orangnya  beban bgt sumpah  duit abis dan ngerasa ngerepotin bgt w  ,beban,pernah diposisi dicari walaupun cuma itu itu aja orangnya beban banget sumpah duit abis dan ngerasa ngerepotin banget aku
2022-06-28 08:41:12+00:00,vllataenie, duh dikatain beban am anak tiktok  yailah bro  disappointed face ,beban,duh dikatain beban am anak tiktok yailah bro disappointed face
2022-06-28 08:40:11+00:00,beenAhuman, nah ini nih  kek beban bgt,beban,nah ini ini seperti beban banget
2022-06-28 08:39:37+00:00,cluescents,ketawa bgt  hobby gue beneran gemar nambahin beban ke sapa loudly crying face  loudly crying face  folded hands ,beban,ketawa banget hobby aku beneran gemar nambahin beban ke sapa loudly crying face loudly crying face folded hands
2022-06-28 08:39:35+00:00,ttmlfh, tapi beban mentalnya lumayan   ,beban,tapi beban mentalnya lumayan
2022-06-28 08:39:34+00:00,alcessia790, yg cewe beban,beban,yang cewe beban
2022-06-28 08:39:25+00:00,caaaaaaaaaaaa__,  ngam oh hilang beban 10k  upah tak duak 5k jak sama dirik nak ohh  face holding back tears ,beban,ngam oh hilang beban 10k upah tidak duak 5k jak sama dirik mau ohh face holding back tears
2022-06-28 08:38:59+00:00,missw1n,beban,beban,beban
2022-06-28 08:38:34+00:00,idntimes,bayi yang belum imunisasi jadi beban ganda pandemik ,beban,bayi yang belum imunisasi jadi beban ganda pandemik
2022-06-28 08:38:10+00:00,arnbear, awowkwk yang beban itu army tiktod  ,beban,awowkwk yang beban itu army tiktod
2022-06-28 08:38:08+00:00,bunbears_, fc cuma bonus  yang jadi point  nya jalan ceritanya itu sendirii  bawa santaii aja ygy grinning face with sweat  baca au buat hib  ,beban,fc cuma bonus yang jadi point nya jalan ceritanya itu sendirii bawa santaii aja ygy grinning face with sweat baca au buat hib
2022-06-28 08:37:51+00:00,matchabknrumput, go 4jt wangsit   buku dll   500k gojek bolak balik les yallah 50k les    lesnya 2x minggu sadhar 200k x  ,beban,go 4jt wangsit buku dan lain-lain 500k gojek bolak balik les yallah 50k les lesnya 2x minggu sadhar 200k x
2022-06-28 08:37:16+00:00,emeienaroui,alhamdulillah ya allah  ga jadi beban ortu folded hands  loudly crying face   allah tau baget keadaan hambanya,beban,alhamdulillah ya allah tidak jadi beban ortu folded hands loudly crying face allah tau baget keadaan hambanya
2022-06-28 08:37:09+00:00,elyapujautamii, sumpah beban bgt bacanya  ovt lagi kan gw face exhaling  face exhaling ,beban,sumpah beban banget bacanya ovt lagi kan aku face exhaling face exhaling
2022-06-28 08:37:09+00:00,Gheea12, plis deh  jangan nambah beban pikiran  sesungguhnya umat manusia jika mempersulit manusia laiinnya maka ia akan di azab,beban,plis deh jangan nambah beban pikiran sesungguhnya umat manusia jika mempersulit manusia laiinnya maka ia akan di azab
2022-06-28 08:36:48+00:00,jayblajar22,  sama  gue takut beban mental,beban,sama aku takut beban mental
2022-06-28 08:35:29+00:00,fsskroeppreal,menepilah  kamu nampak lelah  kemarilah  lepaskan beban bebanmu itu di pelukanku   ,beban,menepilah kamu nampak lelah kemarilah lepaskan beban bebanmu itu di pelukanku
2022-06-28 08:35:14+00:00,SutanNasrul, aturan penerbangan  bbm yg dipakai pada awal perjalanan harus dilebihkan dari konsumsi   ketika akan  ,beban,aturan penerbangan bbm yang dipakai pada awal perjalanan harus dilebihkan dari konsumsi ketika akan
2022-06-28 08:34:52+00:00,jivamagnolya, 1 460 jt  semoga tembus dimandiri biar ga terlalu jadi beban pensive face ,beban,1 460 jt semoga tembus dimandiri biar tidak terlalu jadi beban pensive face
2022-06-28 08:34:38+00:00,Mataminimaliz,ortu masih lengkap masih pada sehat juga tapi berasa banget mikul beban kebutuhan buat rumah udah gtu kedua ortu ra  ,beban,ortu masih lengkap masih pada sehat juga tapi berasa banget mikul beban kebutuhan buat rumah udah gitu kedua ortu ra
2022-06-28 08:34:24+00:00,leovaldhez,mpkt sampe akhir semester msh beban aje anjg,beban,mpkt sampe akhir semester masih beban aja anjing
2022-06-28 08:34:11+00:00,eolmay,haii i m back  akhirnyaa bisa twitteran 24 7 tanpa beban loudly crying face  yaa walaupun cmn wktu liburan semesteran ini doang smiling face with tear ,beban,haii i m back akhirnyaa bisa twitteran 24 7 tanpa beban loudly crying face yaa walaupun cuma wktu liburan semesteran ini doang smiling face with tear
2022-06-28 08:33:33+00:00,JakmaniaSkh,dear   udah  main lepas aja  jangan ada beban untuk menang  gua ga bakal kecewa ko kalo kalah  ekspekta  ,beban,dear udah main lepas aja jangan ada beban untuk menang aku tidak bakal kecewa ko kalo kalah ekspekta
2022-06-28 08:32:55+00:00,trejopriv, go 4jt an  buku the king 125k pendaftaran sbm 250k tiket kereta pp 140k hotel bareng temen 200k daftar  ,beban,go 4jt an buku the king 125k pendaftaran sbmtn 250k tiket kereta pp 140k hotel bareng temen 200k daftar
2022-06-28 08:32:28+00:00,oishiisoda, aku kira hidup aja udah beban   ternyata fangirling jd beban juga kl gini  ,beban,aku kira hidup aja udah beban ternyata fangirling jadi beban juga kalau gini
2022-06-28 08:32:11+00:00,shiroishiro00, makin terasa jadi beban keluarganya,beban,makin terasa jadi beban keluarganya
2022-06-28 08:31:54+00:00,mitsuoyaa,izumi walaupun tipikal pacar beban tp dia punya effort ,beban,izumi walaupun tipikal pacar beban tapi dia punya effort
2022-06-28 08:31:52+00:00,BNNyaaa,seberat apapun beban masalah yang kamu hadapi saat ini  percayalah bahwa semua itu tidak pernah melebihi batas kemampuan kamu  eaw,beban,seberat apapun beban masalah yang kamu hadapi saat ini percayalah bahwa semua itu tidak pernah melebihi batas kemampuan kamu eaw
2022-06-28 08:31:50+00:00,apocalypticola, tujuan utama gue sebenernya mau adek gue bisa pergi sejauh mungkin ngejar ambisinya tanpa mikir 2 k  ,beban,tujuan utama aku sebenernya mau adik aku bisa pergi sejauh mungkin ngejar ambisinya tanpa mikir 2 k
2022-06-28 08:31:48+00:00,luvrasa, beban hidup aja udah ribet  masa username sosmed ribet juga nanti pusing loudly crying face  loudly crying face  loudly crying face ,beban,beban hidup aja udah ribet masa username sosmed ribet juga nanti pusing loudly crying face loudly crying face loudly crying face
2022-06-28 08:31:14+00:00,karirfess,kr  hai  aku lulusan smk 2020  masih cari2 kerja  terus ada tawaran kuliah gratis  pleading face  aku bimbang soalnya hatiku pe  ,beban,kr hai aku lulusan smk 2020 masih cari2 kerja terus ada tawaran kuliah gratis pleading face aku bimbang soalnya hatiku pe
2022-06-28 08:31:09+00:00,merona_satire,  nih bun  apapun itu kita menanggung beban orang yg mengikuti kita  karena  apapun yang  ,beban,ini bun apapun itu kita menanggung beban orang yang mengikuti kita karena apapun yang
2022-06-28 08:31:02+00:00,HeikalYudha22,  alhamdillah  jangan latihan motor sel  tetaplah jadi beban buat temen2 lu  folded hands ,beban,alhamdillah jangan latihan motor sel tetaplah jadi beban buat temen2 kamu folded hands
2022-06-28 08:30:45+00:00,scraxsim,ga ada dosanya gangguin orang ini beban ,beban,tidak ada dosanya gangguin orang ini beban
2022-06-28 08:30:29+00:00,aesthethi,alhamdulillah finish for ecj  sparkles  beban berkurang satu persatu thumbs up light skin tone ,beban,alhamdulillah finish for ecj sparkles beban berkurang satu persatu thumbs up light skin tone
2022-06-28 08:30:15+00:00,strawberriesdk,habis itu beban hidupku abis deh  sisa 2 pc yang kebablasan nyoret aja  d,beban,habis itu beban hidupku abis deh sisa 2 pc yang kebablasan nyoret aja d
2022-06-28 08:30:10+00:00,__selviseptiani,hanya tidak ingin menjadi beban siapapun ,beban,hanya tidak ingin menjadi beban siapapun
2022-06-28 08:30:09+00:00,bucingranger,mama  dek  km tu kerjaannya haha hihi haha hihi gaada beban  enteng bgt hidupmu ya nak  aku setiap malam  ovt  mena  ,beban,mama dek kamu itu kerjaannya haha hihi haha hihi gaada beban enteng banget hidupmu ya mau aku setiap malam ovt mena
2022-06-28 08:29:49+00:00,Nadasenjaa_,aku sedang belajar membiasakan diri  sedang belajar bagaimana mengikhlaskan sebuah kepergian  belajar bagaimana mel  ,beban,aku sedang belajar membiasakan diri sedang belajar bagaimana mengikhlaskan sebuah kepergian belajar bagaimana mel
2022-06-28 08:29:31+00:00,deareveryonenu, aamiin kak  semangat yaa  kalo beban mu segitu  yakin deh reward yg allah kasih jauuh lebih lebih pok  ,beban,aamiin kak semangat yaa kalo beban mu segitu yakin deh reward yang allah kasih jauuh lebih lebih pok
2022-06-28 08:29:27+00:00,rrrrrafla,  makanya mending main sama orang yg emang nganggep kamu teammate  bukan beban atau sampah apapun role mu ,beban,makanya mending main sama orang yang emang nganggep kamu teammate bukan beban atau sampah apapun role mu
2022-06-28 08:29:06+00:00,Yayaya4858859,  ya beda nder  bawa beban hidupnya nambah soalnya  face with tears of joy ,beban,ya beda sender bawa beban hidupnya nambah soalnya face with tears of joy
2022-06-28 08:28:56+00:00,mignoen, si paling bukan beban,beban,si paling bukan beban
2022-06-28 08:28:54+00:00,markleesnct,taii nambah beban ultah deui ini anjiirrlah  clown face  clown face  clown face ,beban,taii nambah beban ultah deui ini anjiirrlah clown face clown face clown face
2022-06-28 08:28:17+00:00,foxiew00,jadi  adik gw kayanya kalo daftar st4n kayanya pastitlolos  w tahu kemampuan di tes sejenis cpns bagus banget  masa  ,beban,jadi adik aku kayanya kalo daftar st4n kayanya pastitlolos aku tahu kemampuan di tes sejenis cpns bagus banget masa
2022-06-28 08:28:05+00:00,TrisaktiMebel,biasakan segera mencuci piring kotor di dapur  semakin cepat anda melakukannya  maka beban anda menjaga kebersihan dapur akan semakin ringan,beban,biasakan segera mencuci piring kotor di dapur semakin cepat anda melakukannya maka beban anda menjaga kebersihan dapur akan semakin ringan
2022-06-28 08:27:49+00:00,telurasin99, kalian akan masuk janah dengan damai    kalimat hadits ini berperan sebagai slogan kaum mukminin yang mampu meletu  ,beban,kalian akan masuk janah dengan damai kalimat hadits ini berperan sebagai slogan kaum mukminin yang mampu meletu
2022-06-28 08:27:41+00:00,akunkiia, wajib banget ini mah  kalau ga jadi beban keluarga lagi    ,beban,wajib banget ini mah kalau tidak jadi beban keluarga lagi
2022-06-28 08:27:21+00:00,Cmeansevrything,ngga soalnya gada duit wkwkwk alhamdulilah jd ga nambah beban di lemari buku  pensive face  ,beban,tidak soalnya gada duit wkwkwk alhamdulilah jadi tidak nambah beban di lemari buku pensive face
2022-06-28 08:26:26+00:00,Rizkamylndp_,merekapun pasti memiliki masalah masing masing saya hanya tidak ingin menjadi beban pikiran mereka juga dan lagi ti  ,beban,merekapun pasti memiliki masalah masing masing saya hanya tidak ingin menjadi beban pikiran mereka juga dan lagi ti
2022-06-28 08:26:18+00:00,luvhcssi, kalo kaya gini mending ga usah solo  beban,beban,kalo kaya gini mending tidak usah solo beban
2022-06-28 08:26:14+00:00,yourmarkl,yh 2 beban pikiran w hari ini sudab hilang n sudah jelas ,beban,yah 2 beban pikiran aku hari ini sudab hilang dan sudah jelas
2022-06-28 08:25:47+00:00,kyrhmaa,sgt amt mjd beban,beban,sangat amt menjadi beban
2022-06-28 08:25:32+00:00,nrqmrr, iya enak bangun bangun udah gada beban wkwk,beban,iya enak bangun bangun udah gada beban wkwk
2022-06-28 08:25:16+00:00,dearzenin, gue sih udah gak stress gak jadi beban juga  wong gue gak ada beban  cuma ini gak tepat dikatakan stress   ,beban,aku sih udah tidak stress tidak jadi beban juga wong aku tidak ada beban cuma ini tidak tepat dikatakan stress
2022-06-28 08:25:14+00:00,reysarosdayanti,antara senang sama beban,beban,antara senang sama beban
2022-06-28 08:25:06+00:00,Memosastra5,ekspektasi masyarakat terhadap tampilnya anies rasyid baswedan menjadikan biaya kampanye capresnya akan menjadi san  ,beban,ekspektasi masyarakat terhadap tampilnya anies rasyid baswedan menjadikan biaya kampanye capresnya akan menjadi san
2022-06-28 08:25:04+00:00,KataPematah,  ya syukur kalau gak pernah  suci berarti  kalau aku sama teman ya sering  namanya juga candaan  ,beban,ya syukur kalau tidak pernah suci berarti kalau aku sama teman ya sering namanya juga candaan
2022-06-28 08:24:07+00:00,hoonsyoung, ini yg jadi beban pikiran gue daritadii,beban,ini yang jadi beban pikiran aku daritadii
2022-06-28 08:24:04+00:00,kiyeounlino, bener bangett  mereka yg nemenin dari jaman masih jadi bocil alay sampe skrg banyak beban hidup  masa  ,beban,bener bangett mereka yang nemenin dari jaman masih jadi bocil alay sampe skrg banyak beban hidup masa
2022-06-28 08:23:33+00:00,_Andrizbarant__, jan aku banget kuwi  diutangi adalah beban  beaming face with smiling eyes  beaming face with smiling eyes  beaming face with smiling eyes ,beban,jan aku banget kuwi diutangi adalah beban beaming face with smiling eyes beaming face with smiling eyes beaming face with smiling eyes
2022-06-28 08:23:28+00:00,najmaanjay,gue td cuma bilang kalo temen gue keterima di smk 1 jkt  trs mak gue malah ngomong  kalo ngomong begitu tu pgn mara  ,beban,aku tadi cuma bilang kalo temen aku keterima di smk 1 jkt terus mak aku malah ngomong kalo ngomong begitu itu pgn mara
2022-06-28 08:23:16+00:00,4ddest, memang beban keluarga,beban,memang beban keluarga
2022-06-28 08:23:05+00:00,windflowersss, kalo aku lebih ke beban timbangan sih sbenarny,beban,kalo aku lebih ke beban timbangan sih sbenarny
2022-06-28 08:22:55+00:00,juhaiman15, seharusnya ikn ngga dibuat  beban rakyat saja ,beban,seharusnya ikn tidak dibuat beban rakyat saja
2022-06-28 08:22:24+00:00,melicoww, tersenyum beban,beban,tersenyum beban
2022-06-28 08:22:17+00:00,MalaysiaGazette,kurangkan beban kos rakyat malaysiagazette ,beban,kurangkan beban kos rakyat malaysiagazette
2022-06-28 08:21:44+00:00,erlnmyrsh,lagian kenapa sih harus bikin gua mikir yg enggak enggak  emng ga kepikiran apa klo omongan lu bakal jdi beban pikiran orang lain bangsat,beban,lagian kenapa sih harus bikin aku mikir yang enggak enggak emang tidak kepikiran apa kalau omongan kamu bakal jadi beban pikiran orang lain bangsat
2022-06-28 08:21:32+00:00,oktiasr,menatap langit lalu berbagi cerita  berharap beban ini terbagi sedikit  ingin berteriak kepada semesta bahwa ini cu  ,beban,menatap langit lalu berbagi cerita berharap beban ini terbagi sedikit ingin berteriak kepada semesta bahwa ini cu
2022-06-28 08:21:20+00:00,prilaprilia8,si beban keluarga  slightly smiling face  ,beban,si beban keluarga slightly smiling face
2022-06-28 08:21:01+00:00,kangmekdi,  gapernah si bang ngata in orang beban mah  gw ga jago juga soalnya  abangnya sering ya  pasti pro player,beban,gapernah si bang ngata in orang beban mah aku tidak jago juga soalnya abangnya sering ya pasti pro player
2022-06-28 08:20:48+00:00,hahahasabil, aduh sbnrnya takut klo diitung hehe  bimbel offline 5 5jt  bimbel online  qiupper  600k  zenius 290k  m  ,beban,aduh sbnrnya takut kalau diitung hehe bimbel offline 5 5jt bimbel online qiupper 600k zenius 290k m
2022-06-28 08:20:25+00:00,lulabywithme,ya gmn anaknya mau ngerti  ngmg aja enggak   meski emg sbnrnya kk ku pun kek tai juga dibilangin malah ga peduli da  ,beban,ya bagaimana anaknya mau ngerti ngmg aja enggak meski emang sbnrnya kakak aku pun seperti tai juga dibilangin malah tidak peduli da
2022-06-28 08:19:57+00:00,dhydudidam, mungkin sekalian doanya buat semua beban idup lu menk,beban,mungkin sekalian doanya buat semua beban idup kamu menk
2022-06-28 08:19:49+00:00,fishikuy,g berani ngejumlah krn gagal semuaa wkwkw beban keluarga ,beban,tidak berani ngejumlah karena gagal semuaa wkwkw beban keluarga
2022-06-28 08:19:33+00:00,leeyayasminee, allahu yeke  aku beban ke ni   pleading face ,beban,allahu iyakah aku beban ke ni pleading face
2022-06-28 08:19:28+00:00,inistephdisini,akhirnya pergi  hangout  beneran yaa skrg dan temennya ga itu  mulu slightly smiling face  folded hands  ofc tdk beban smiling face ,beban,akhirnya pergi hangout beneran yaa skrg dan temennya tidak itu mulu slightly smiling face folded hands ofc tidak beban smiling face
2022-06-28 08:18:58+00:00,Ardyan_jaya, beban kehidupan,beban,beban kehidupan
2022-06-28 08:17:58+00:00,Astungkara13, yang penting happy  setidaknya beban hidup keluar,beban,yang penting happy setidaknya beban hidup keluar
2022-06-28 08:17:05+00:00,manutd_world,neil ryan   saya selalu percaya jika scott dapat menjadi pemain luar biasa untuk mufc  ia menanggung beban yang sa  ,beban,neil ryan saya selalu percaya jika scott dapat menjadi pemain luar biasa untuk mufc ia menanggung beban yang sa
